"PRINCE HALL COLONIAL PARK DAY CARE CENTER","159-30 HARLEM RIVER DRIVE",10039,212-281-1444,Permitted
"PROJECT SOCIAL CARE HEAD START","1876 50TH STREET",11204,718-871-3100,Permitted
"PROJECT SOCIAL CARE HEAD START","382 WILLOUGHBY AVENUE",11205,718-871-3100,Permitted
"PROJECT SOCIAL CARE HEAD START","5202 13 AVENUE",11219,718-436-6868,Permitted
"PROJECT SOCIAL CARE HEADSTART","80 SKILLMAN STREET",11205,718-599-2900,Permitted
"PROMISE WORLD DAY CARE,INC.","1968 OCEAN AVENUE",11230,718-743-2828,Permitted
"PROSPECT FAMILY INN","730 KELLY STREET",10455,718-617-6100,Permitted
"PROSPECT KIDS ACADEMY #2","532 ST. JOHNS PLACE",11238,718-638-9300,"Expired-In Renewal"
"PROSPECT KIDS ACADEMY, INC.","341 PROSPECT AVENUE",11215,718-788-7727,Permitted
"PROVIDENCE REST CHILD DAY CARE CENTER ,INC.","3310 CAMPBELL DRIVE",10465,718-823-3588,Permitted
PS,"1725  YORK AVENUE",10128,212-774-8000,Permitted
"PUERTO RICAN FAMILY INSTITUTE BROOKLYN HEAD START","185 MARCY AVENUE",11211,718-388-6060,Permitted
"PURPLE CIRCLE DAY CARE CENTER INC,","251 WEST 100 STREET",10025,212-866-9193,Permitted
"PUSTEBLUME GERMAN LANGUAGE PRESCHOOLS AND AFTER-SCHOOL PROGAMS","244 WEST 14TH STREET",10011,212-206-1137,Permitted
"QHC DAYCARE CENTER","43-29 162ND STREET",11358,718-939-3606,Permitted
QSAC,"245-37 60 AVENUE",11362,718-728-8476,Permitted
"QUALITY OF LIFE ACADEMY DAY CARE - INFANT/TODDLER","762 41ST STREET",11232,718-437-7247,Permitted
"QUALITY OF LIFE ACADEMY DAY CARE - PRESCHOOL","762 41ST STREET",11232,718-437-7247,Permitted
"QUEENS CENTER FOR PROGRESS","82-25 164 STREET",11432,718-374-0002,Permitted
"QUEENSBRIDGE EARLY CHILDHOOD DEVELOPMENT CENTER","38-11 27TH STREET",11101,718-937-7640,Permitted
"QUEENSVIEW NURSERY SCHOOL AND KINDERGARTEN","21-36 33 ROAD",11106,718-728-4164,Permitted
"QUICK START D.C.C. INC.","118-46 RIVERTON STREET",11412,718-978-0800,Permitted
"QUICK START D.C.C.,INC.","126-22 150 STREET",11436,718-659-6928,Permitted
"RAINBOW CHILD DEVELOPMENT","133-20 AVERY    AVENUE",11355,718-496-5513,Permitted
"RAINBOW CHILD DEVELOPMENT CENTER","133-20 AVERY    AVENUE",11355,718-658-3030,Permitted
"RAINBOW CHILD DEVELOPMENT CENTER","77-42 164 STREET",11366,718-969-1900,Permitted
"RAINBOW CHILD DEVELOPMENT CENTER -PRESCHOOL","133-20 AVERY    AVENUE",11355,718-658-3030,Permitted
"RAINBOW CHILD DEVELOPMENT CENTER, INC.","77-42 164 STREET",11366,718-969-1900,Permitted
"RAINBOW CHRISTIAN PRESCHOOL AND KINDERGARTEN","72-01 43 AVENUE",11377,718-335-3361,Permitted
"RAINBOW KIDDIE ACADEMY I","880 THIERIOT AVENUE",10473,718-620-6565,Permitted
"RAINBOW MONTESSORI ACADEMY","816 CLARENCE AVE",10465,347-810-8744,Permitted
"RAINBOW MONTESSORI ACADEMY","816 CLARENCE AVE",10465,347-810-8744,Permitted
"RAINBOW PRE-SCHOOL","3844 FLATLANDS AVENUE",11234,718-377-2918,Permitted
"RAINBOW PRE-SCHOOL (#1)","3846 FLATLANDS AVENUE",11234,718-377-2918,Permitted
"RAINBOW RHYMES LEARNING CENTER","4041 BRUNER AVENUE",10466,718-882-2388,Permitted
"RAINBOW RHYMES LEARNING CENTER","4041 BRUNER AVENUE",10466,718-882-2388,Permitted
"RAINBOWLAND NURSERY SCHOOL","33-11 77 STREET",11372,718-803-1728,Permitted
"RAINBOWLAND NURSERY SCHOOL","33-11 77 STREET",11372,718-803-1728,Permitted
"RAINBOWLAND NURSERY SCHOOL","39-60 54 STREET",11377,718-899-7590,Permitted
"RAINBOWLAND NURSERY SCHOOL","39-60 54TH STREET",11377,718-899-7590,Permitted
"RALPH HIRSCHKORN CHILD CARE CENTER","310 BEACH 20 STREET",11691,718-327-1141,Permitted
"RAVEN LEARNING CENTER, INC. INF/TODDLER","1102 EAST 92ND STREET",11236,718-927-2316,Permitted
"REACH FOR THE STARS ACADEMY, INC.","1200 DEAN STREET",11216,718-773-4600,Permitted
"READY SET LEARN","830 FOX STREET",10459,718-484-8210,Permitted
"READY SET LEARN CHILD CARE","9010 AVENUE A",11236,718-552-2556,Permitted
"READY, SET, GROW!","136-16 31 ROAD",11354,718-888-7871,Permitted
"READY, SET, GROW!","136-16 31 ROAD",11354,718-888-7871,Permitted
"RECREATION ROOMS AND SETTLEMENT STARRET EARLY LEARNING","125 SCHROEDERS AVENUE",11239,718-642-8724,Permitted
"RED APPLE CHILD DEVELOPMENT CENTER","133-32 41 ROAD",11355,718-939-8805,Permitted
"RED APPLE CHILD DEVELOPMENT CENTER","25 MARKET STREET",10002,212-577-2710,Permitted
"RED APPLE CHILD DEVELOPMENT CENTER","25 MARKET STREET",10002,212-577-2710,Permitted
"RED APPLE DEVELOPMENT CENTER","42-31 COLDEN STREET",11355,718-762-1232,"Expired-In Renewal"
"RED BALLOON DAY CARE CENTER","560 RIVERSIDE DRIVE",10027,212-663-9006,Permitted
"RED FISH BLUE FISH INT&#39;L PRESCHOOL AND EARLY LEARNING CENTER, CORP.","188-12 73 AVENUE",11366,718-464-6131,Permitted
"RED HAT DAY CARE CENTER","1317 EAST 15TH STREET",11230,718-336-1480,Permitted
"RED HOOK PLAYGROUP","295 COLUMBIA ST",11231,718-797-4186,Permitted
"REDEEMER LUTHERAN NURSERY SCHOOL","92-10 217 STREET",11428,718-465-3252,Permitted
"REDEEMER ST. JOHN&#39;S NURSERY SCHOOL","939 83 STREET",11228,718-833-7700,Permitted
"REGENT SCHOOL","719 EAST 216 STREET",10467,718-653-2900,Permitted
"REGO PARK DAY SCHOOL","63-44 WETHEROLE STREET",11374,718-897-0693,Permitted
"REGO PARK DAYSCHOOL # 1","63-44 WETHEROLE STREET",11374,718-897-0693,Permitted
"RENA DAY CARE INC.","639 EDGECOMBE AVENUE",10032,212-795-4444,"Expired-In Renewal"
"RENAISSANCE VILLAGE","220 CABRINI BOULEVARD",10033,212-928-7855,Permitted
"RENANIM  AT  RIVERDALE   I/T","2975 INDEPENDENCE AVENUE",10463,718-601-1300,Permitted
"RENANIM  MANHATTAN, INC.","336 EAST 61 STREET",10065,212-750-2266,Permitted
"RENANIM ACADEMY PRESCHOOL","141-29 84 DRIVE",11435,917-750-2131,Permitted
"RESURRECTION EPISCOPAL DAY SCHOOL","119 EAST 74 STREET",10021,212-535-9666,"Expired-In Renewal"
"RHINELANDER CHILDREN&#39;S AID SOCEITY","350 EAST 88 STREET",10128,212-876-0500,Permitted
"RICHMOND EARLY LEARN CENTER","159 BROADWAY",10310,917-426-0300,Permitted
"RICHMOND HILL CHILDREN&#39;S CENTER","501 RICHMOND HILL ROAD",10314,718-494-7422,Permitted
"RICHMOND HILL DAY CARE","115-24 MYRTLE AVENUE",11418,718-441-8191,Permitted
"RICHMOND HILL DAY CARE","115-24A MYRTLE AVENUE",11418,718-441-8191,Permitted
"RIDGEWOOD PRE-SCHOOL CENTER","59-14 70 AVENUE",11385,718-456-1075,Permitted
"RIDGEWOOD YMCA CHILD CARE CENTER","69-02 64 STREET",11385,212-912-2180,Permitted
"RING AROUND THE ROSIE PRESCHOOL","7104 13 AVENUE",11228,718-492-7464,Permitted
"RING AROUND THE ROSIE PRESCHOOL  II","7106 13TH AVENUE",11228,718-492-7464,Permitted
"RISE &amp; SHINE LEARNING CENTER","512 ROCKAWAY AVENUE",11212,917-691-0901,Permitted
"RISE &amp; SHINE OF FOREST HILLS","68-38 YELLOWSTONE BLVD.",11375,347-949-4296,Permitted
"RITA GOLD EARLY CHILDHOOD CENTER","525  WEST 120TH STREET BOX 98",10027,212-678-3013,Permitted
"RITA GOLD EARLY CHILDHOOD CENTER","525 WEST 120 STREET",10027,212-678-3013,Permitted
"RIVENDELL SCHOOL","277 3RD AVENUE",11215,718-499-5667,Permitted
"RIVER PARK NURSERY SCHOOL AND KINDERGARTEN","711 AMSTERDAM AVENUE",10025,212-663-1205,Permitted
"RIVER SCHOOL - WESTSIDE (INFANT/ TODDLER)","75 WEST END AVENUE",10023,212-707-8300,Permitted
"RIVER SCHOOL-WESTSIDE P/S","75 WEST END AVENUE",10023,212-707-8300,Permitted
"RIVERALE NURSERY SCHOOL AND FAMILY CENTER","3816 WALDO AVENUE",10463,718-884-3950,Permitted
"RIVERDALE  Y  EARLY CHILDHOOD CENTER","5625 ARLINGTON AVENUE",10471,718-548-8200,Permitted
"RIVERDALE COMMUNITY SCHOOL","25 KNOLLS CRESCENT",10463,718-543-0050,"Expired-In Renewal"
"RIVERDALE COUNTRY SCHOOL INFANT TODDLER CENTER","5250 FIELDSTON ROAD",10471,718-519-2761,"Expired-In Renewal"
"RIVERDALE COUNTRY SCHOOL INFANT TODDLER CENTER","5250 FIELDSTON ROAD",10471,718-549-8810,Permitted
"RIVERDALE MONTESSORI SCHOOL","5705 MOSHOLU AVE",10471,718-543-4884,Permitted
"RIVERDALE NEIGHBORHOOD HOUSE","5555 MOSHOLU AVENUE",10471,718-549-8100,Permitted
"RIVERDALE NEIGHBORHOOD HOUSE INC.","5521 MOSHOLU AVENUE",10471,718-549-8100,Permitted
"RIVERDALE PRESBYTERIAN CHURCH NURSERY SCHOOL","4765 HENRY HUDSON PARKWAY",10471,718-548-8260,Permitted
"RIVERDALE TEMPLE NURSERY SCHOOL","4545 INDEPENDENCE AVENUE",10471,718-796-0335,Permitted
"RIVERSIDE MONTESSORI SCHOOL","202 RIVERSIDE DRIVE",10025,212-665-1600,Permitted
"RIVERSIDE MONTESSORI SCHOOL","202 RIVERSIDE DRIVE",10025,212-665-1600,Permitted
"RM PREP, LLC","75-77 READE STREET",10007,212-513-7735,Permitted
"ROBERTA BRIGHT EARLY LEARNING CENTER","3001 WEST 37 STREET",11224,718-266-5333,Permitted
"ROCHDALE VILLAGE KINDERGARTEN","170-10 130 AVENUE",11434,718-723-2224,Permitted
"ROCHDALE VILLAGE NURSERY SCHOOL","170-30 130 AVENUE",11434,718-723-2224,Permitted
"ROCHDALE VILLAGE PRE-SCHOOL","170-20 130 AVENUE",11434,718-723-2224,Permitted
"ROCKAWAY CHILD CARE CENTER","14-66 BEACH CHANNEL DRIVE",11691,718-327-1384,Permitted
"RODI DAYCARE CENTER","3560 NETHERLAND AVENUE",10463,718-601-0406,Permitted
"ROGERS&#39; DAY CARE","775 ROGERS AVENUE",11226,718-703-4312,Permitted
"ROOSEVELT ISLAND DAY NURSERY","4 RIVER ROAD",10044,212-593-0750,"Expired-In Renewal"
"ROOSEVELT ISLAND DAY NURSERY","405 MAIN STREET",10044,212-593-0750,Permitted
"ROOSEVELT ISLAND DAY NURSERY","405 MAIN STREET",10044,212-935-3747,Permitted
"RORY&#39;S ROOM  PRESCHOOL","3001 FORT HAMILTON PARKWAY",11218,718-435-4950,Permitted
"ROUND THE CLOCK NURSERY","301 WEST 130 STREET",10027,212-694-0615,Permitted
"ROUND THE CLOCK NURSERY, INC","2380 MARION AVENUE",10458,718-329-6023,Permitted
"ROUND THE CLOCK NURSERY, INC","3333 Broadway",10031,212-234-1870,Permitted
"ROUND THE CLOCK NURSERY, INC.","301B WEST 130 STREET",10027,212-694-0615,Permitted
"SACRED HEART DAY CARE CENTER INC","1069 NOSTRAND AVENUE",11225,718-221-5500,Permitted
"SACRED HEART HEAD START","95 WEST 168TH STREET",10452,718-293-2006,Permitted
"SAINT ALBANS MONTESSORI DAY CARE CENTER INC.","118-49 MONTAUK STREET",11412,718-341-5945,Permitted
"SAINT CLARE EARLY CHILDHOOD PROGRAM","150 NELSON AVENUE",10308,718-967-0990,Permitted
"SAINTILUS DAY CARE CENTER","951 EAST 84TH STREET",11236,718-209-1347,Permitted
"SALANTER AKIBA RIVERDALE ACADEMY (SAR ACADEMY)","655 WEST 254TH STREET",10471,718-548-1717,Permitted
"SAMUEL FIELD Y - CHILD CARE CENTER","58-20 LITTLE NECK PARKWAY",11362,718-225-6750,Permitted
"SAMUEL FIELD Y-BAY TERRACE PRESCHOOL CENTER","212-00 23 AVENUE",11360,718-423-6111,Permitted
"SANDRA&#39;S SUNFLOWER CHILD CARE, INC.","90-16 SUTPHIN BLVD.",11435,347-454-9079,Permitted
"SARATOGA DAY CARE  (P.S.)","1797 PARK PLACE (406 SARATOGA AVENUE ENTRANCE)",11233,347-955-4145,Permitted
"SARATOGA DAY CARE, INFANT/TODDLER PROGRAM","1797 PARK PLACE (406 SARATOGA AVENUE ENTRANCE)",11233,347-955-4145,Permitted
"SCAN  LAGUARDIA  HOUSE NURSERY","414 EAST 105TH STREET",10029,212-722-7441,"Expired-In Renewal"
"SCO FAMILY OF SERVICES-MORRIS KOPPLEMAN EARLY CHILDHOOD EDUCATION CENTER","774 SARATOGA AVENUE",11212,718-345-6666,Permitted
"SCO FAMILY OF SERVICES-SHIRLEY CHISHOLM EARLY CHILDHOOD EDUCATION CENTER","69 SARATOGA AVENUE",11233,718-443-4100,Permitted
"SEABURY DAY CARE CENTER","575 SOUNDVIEW AVENUE",10473,718-991-1500,Permitted
"SECOND HOUSING NURSERY","161-55 JEWEL AVENUE",11365,718-591-2399,Permitted
"SEMILLITAS CHILDREN EDUCATION CENTER","81-07 NORTHERN BOULEVARD",11372,718-507-2723,Permitted
"SEPHARDIC ACADEMY OF MANHATTAN","1274 SECOND AVENUE",10065,212-249-6391,Permitted
"SEPHARDIC COMMUNITY EARLY CHILDHOOD CENTER","1901 OCEAN PARKWAY",11223,718-627-4300,Permitted
"SESAME SPROUT","96-08 57 AVENUE",11368,718-213-4326,Permitted
"SETON DAY CARE CENTER","245 EAST 92ND  STREET",10128,212-369-9626,Permitted
"SEVENTH  AVENUE  CENTER  FOR FAMILY  SERVICES HEAD START","711 LENOX AVENUE",10039,212-862-0600,Permitted
"SEVENTH AVENUE CENTER FOR FAMILY SERVICES","1646 MONTGOMERY AVENUE",10453,718-901-0140,Permitted
"SHALOM YELADIM EARLY CHILDHOOD CENTER.","135 BENNETT AVENUE",10040,212-568-1900,Permitted
"SHARON  BAPTIST  HEAD START - CENTER 4 (DELEGATE PROGRAM)","1925 BATHGATE AVENUE",10457,718-466-1604,Permitted
"SHARON BAPTIST HEAD START","279-281 EAST BURNSIDE AVENUE",10457,718-299-6500,Permitted
"SHARON BAPTIST HEAD START","507-509 EAST 165TH STREET",10456,718-466-1604,Permitted
"SHARON BAPTIST HEAD START - GRANTEE","1925 BATHGATE AVENUE",10457,718-466-1605,Permitted
"SHARON NURSERY SCHOOL","145-15 34 AVENUE",11354,718-539-8467,Permitted
"SHELDON R. WEAVER DAY CARE CENTER","72-05 BEACH CHANNEL DRIVE",11692,718-474-8618,Permitted
"SHELTERING ARMS LEARNING CENTER","2493 ADAM CLAYTON POWELL BLVD",10030,212-368-1743,Permitted
"SHEMA KOLAINU- HEAR OUR VOICES","4302 NEW UTRECHT AVENUE",11219,718-686-9600,Permitted
"SHEMTOV PLAYGROUP","1565 59 STREET",11219,718-633-7529,Permitted
"SHEMTOV PLAYGROUP","4917 14TH AVENUE",11219,718-851-7529,Permitted
"SHIN KWANG CHURCH NURSERY","33-55 BELL BOULEVARD",11361,718-357-3355,Permitted
"SHINING STARS PRE-SCHOOL","1879 BRONXDALE AVENUE",10462,718-409-1316,Permitted
"SHIRA HEAD START BAIS YAAKOV ADAS YEREIM","1169 43RD STREET",11219,718-435-7700,Permitted
"SHIRA HEAD START BAIS YAAKOV I.II,III,IV,V,VL,VLL","4502 14 AVENUE",11219,718-435-5755,Permitted
"SHIRA HEAD START BETH HILLEL I, II, III","1364 42 STREET",11219,718-438-3535,Permitted
"SHIRA HEAD START BNOS ZIONI,I,II,III,IV,V,V1","5002 14TH AVENUE",11219,718-435-7700,Permitted
"SHIRA HEAD START BOYAN I,II","1205 44 STREET",11219,718-435-7700,Permitted
"SHIRA HEAD START CHASAN SOFER I &amp; II","1717 49TH STREET",11204,718-435-7700,Permitted
"SHIRA HEAD START GUR I, II, III,1V,V","1975 51ST STREET",11204,718-435-7700,Permitted
"SHIRA HEAD START SHAAREI HAYOSHER I,II","1334 OCEAN PARKWAY",11230,718-435-7700,Permitted
"SHIRA HEAD START SPINKA I, II","5801 15 AVENUE",11219,718-435-7700,Permitted
"SHIRA HEAD START YESODEI HATORAH","1350 50 STREET",11219,718-435-7700,Permitted
"SHIRLEY CHISHOLM  DAY CARE CENTER # 5","265 SUMPTER STREET",11233,718-452-1200,Permitted
"SHIRLEY CHISHOLM D.C.C. # 2","333 14 Street",11215,718-499-7159,Permitted
"SHIRLEY CHISHOLM DAY CARE CENTER  #1","2023 PACIFIC STREET",11233,718-756-1721,Permitted
"SHIRLEY CHISHOLM DAY CARE CENTER #1","2023 PACIFIC STREET",11233,718-756-1721,Permitted
"SHIRLEY CHISHOLM DAY CARE CENTER #4","33 SOMERS STREET",11233,718-498-6200,Permitted
"SHIRLEY CHISHOLM DAY CARE CENTER #4","33 SOMERS STREET",11233,718-498-6200,Permitted
"SHOLOM DAY CARE","84-37 118 STREET",11415,718-849-9189,Permitted
"SHOLOM DAY CARE INC","82-04 LEFFERTS BOULEVARD",11415,718-441-9893,Permitted
"SHOLOM SHOLOM","116-66 PARK LANE SOUTH",11418,718-850-2934,Permitted
"SHOLOM SHOLOM, INC.","75-11 MAIN STREET",11367,718-850-2934,Permitted
"SHOREFRONT YM-YWHA (PRESCHOOL)","3300 CONEY ISLAND AVENUE",11235,718-646-1444,Permitted
"SHOSTAKOVICH MUSIC, ART AND SPORT SCHOOL, INC","1938 BATH AVENUE",11214,718-372-3716,Permitted
"SHOSTAKOVICH SCHOOL","297 AVENUE X",11223,718-376-8056,Permitted
"SIDI-ENJOLI HASANOEDDIN   (BRIGHT BEGINNING EARLY LEARNING CENTER )","1002 CASTLE HILL AVENUE",10472,347-621-5770,Permitted
"SILVER LAKE HEAD START","10 GREGG PLACE",10301,718-815-4488,Permitted
"SILVER LAKE HEAD START 1","10 GREGG PLACE",10301,718-815-4488,Permitted
"SILVER LAKE HEAD START II","20 PARK HILL CIRCLE",10304,718-720-0090,Permitted
"SILVER LAKE HEAD START II (INFANT/TODDLER)","20 PARK HILL CIRCLE",10304,718-720-0090,Permitted
"SILVER LAKE HEAD START II (PRESCHOOL)","20 PARK HILL CIRCLE",10304,718-720-0090,Permitted
"SJBC CHRISTIANDAY CARE OF NEW YORK, INC.","74-05 ROCKAWAY BEACH BOULEVARD",11692,718-634-4469,"Expired-In Renewal"
SKIP/TIPSE,"156-45 84 STREET",11414,718-738-1800,Permitted
"SMALL WONDER I (INFANT/TODDLER)","3012 AVENUE M",11210,718-692-0355,Permitted
"SMALL WONDER I, INC. P/S","3012 AVENUE M",11210,718-692-0355,Permitted
"SMALL WONDER PRESCHOOL,INC.","90-45 MYRTLE AVENUE",11385,718-849-3002,Permitted
"SMALL WORLD DAY CARE CENTER","211 AINSLIE STREET",11211,718-963-0330,Permitted
"SMALL WORLD PRE-SCHOOL","144 BLOOMINGDALE ROAD",10309,718-356-7795,Permitted
"SMART START DAY CARE","1201 AVENUE K",11230,718-942-5400,Permitted
"SMART START EARLY CHILDHOOD CENTER, INC.","8411 FORT HAMILTON PARKWAY",11209,718-921-1868,Permitted
"SMARTER TODDLER","400  WEST 55TH STREET",10019,212-757-2145,Permitted
"SMARTER TODDLER NURSERY &amp; PRESCHOOL","100 WEST 89 ST",10024,212-721-4964,"Expired-In Renewal"
"SMARTER TODDLER NURSERY &amp; PRESCHOOL","400  WEST 55TH STREET",10019,212-757-2145,Permitted
"SMARTER TODDLER NURSERY &amp; PRESCHOOL  INFANT/TODDLER","100 WEST 89 ST",10024,212-721-4964,"Expired-In Renewal"
"SMILES AROUND US ACADEMY, INC.","351 SAND LANE",10305,718-390-0070,"Expired-In Renewal"
"SMILES AROUND US DAY CARE CENTER","3854 HYLAN BOULEVARD",10308,718-948-0122,Permitted
"SMILES AROUND US FOR INFANTS AND TODDLERS, INC.","343 SAND LANE",10305,718-390-0070,Permitted
"SMILING FACES CHRISTIAN DAY CARE CENTER II","381 MYRTLE AVENUE",11205,718-852-7020,Permitted
"SOCIETY OF THIRD STREET MUSIC SCHOOL SETTLEMENT PRESCHOOL","235 EAST 11 STREET",10003,212-777-3240,Permitted
"SOLADE PRESCHOOL","1111 EAST 89TH STREET",11236,718-763-1742,Permitted
"SOLOMON PRE-SCHOOL","35-20 147 STREET",11354,718-961-5977,Permitted
"SOUND DALE CENTER FOR EARLY CHILDHOOD EDUCATION","1211 CROES AVENUE",10472,718-378-3533,Permitted
"SOUTH BRONX HEAD START","141 FEATHERBED LANE",10452,718-731-0075,Permitted
"SOUTH BRONX HEAD START","490 EAST 143 STREET",10454,718-292-7250,Permitted
"SOUTH BRONX HEAD START PROGRAM INC.","1458 WEBSTER AVENUE",10456,718-538-4112,Permitted
"SOUTH JAMAICA CENTER FOR CHILDREN AND PARENTS, INC.","94-43 159 STREET",11433,718-523-6455,Permitted
"SOUTH SHORE TODDLER ACADEMY &amp; PRE-K","11 SAMPSON AVENUE",10308,718-356-3563,Permitted
"SOUTH SHORE YMCA NURSERY SCHOOL","3939 RICHMOND AVENUE",10312,718-227-3200,Permitted
"SPARKLES DAY CARE","1367 EASTERN PARKWAY",11233,347-295-3000,"Expired-In Renewal"
SPROUTS,"339 8TH STREET",11215,718-965-8573,Permitted
SPROUTS,"421 7TH STREET",11215,718-965-8573,Permitted
"SPUYTEN DUYVIL PRESCHOOL","3041 KINGSBRIDGE AVENUE",10463,718-549-1525,Permitted
"ST ANTHONY HEAD START/ UPK","1750 MANSION STREET",10460,718-823-7202,Permitted
"ST NICHOLAS OF TOLENTINE HEAD START","2331 UNIVERSITY AVENUE",10468,718-364-7608,Permitted
"ST NICHOLAS PRESCHOOL","43-09 196 STREET",11358,718-357-0800,Permitted
"ST SIMON&#39;S HEAD START - U P K","2195 VALENTINE AVENUE",10457,718-933-9471,Permitted
"ST. ALBANS EARLY CHILDHOOD CENTER, INC.","109-53 FARMERS BOULEVARD",11412,718-479-7111,Permitted
"ST. ANDREW&#39;S COMMUNITY DAY CARE CENTER","4917 FOURTH AVENUE",11220,718-492-9678,Permitted
"ST. BENEDICT&#39;&#39;S DAY NURSERY","21 WEST 124 STREET",10027,212-423-5715,Permitted
"ST. DOMINIC&#39;S TORCH","2340 ANDREWS AVENUE",10468,718-365-7238,Permitted
"ST. IGNATIUS LAYOLA DAY NURSERY","240 EAST 84TH STREET",10028,212-734-6427,Permitted
"ST. IRENE CHRYSOVALANTOU NURSERY &amp; KINDERGARTEN","42-11 DITMARS BLVD.",11105,718-626-6225,Permitted
"ST. JEMUEL GROUP FAMILY DAY CARE INC","2836 WEBB AVENUE",10468,718-601-9753,Permitted
"ST. JEMUEL GROUP FAMILY DAY CARE, INC.","2836 WEBB AVENUE",10468,718-601-9753,Permitted
"ST. JOHN&#39;S LUTHERAN PRESCHOOL","86-20 114 STREET",11418,718-441-3611,"Expired-In Renewal"
"ST. JOHN&#39;S PLACE FAMILY CENTER DAY CARE CORPORATION","1620 ST. JOHN&#39;S PLACE",11233,718-771-7720,Permitted
"ST. JOHN&#39;S PLACE FAMILY CENTER HDFC-INFANT AND TODDLER CARE PROGRAM","1620 ST JOHN&#39;S PLACE",11233,718-771-7720,Permitted
"ST. JOSEPH&#39;S SCHOOL FOR THE DEAF","1000 HUTCHINSON RIVER PARKWAY",10465,718-828-9000,Permitted
"ST. LUKES ACADEMY","259 WASHINGTON AVENUE",11205,718-622-5612,Permitted
"ST. MALACHY CHILD DEVELOPMENT CENTER","220 HENDRIX STREET",11207,718-647-0966,Permitted
"ST. MALACHY EARLY CHILDHOOD DEVELOPMENT CENTER","220 HENDRIX STREET",11207,718-647-0966,Permitted
"ST. MARK&#39;S HEAD START","2017 BEVERLY ROAD",11226,718-287-7300,Permitted
"ST. MARTIN OF TOURS HEAD START","695 EAST 182 STREET",10457,718-220-4750,Permitted
"ST. MARTIN&#39;S NURSERY &amp; KINDERGARTEN SCHOOL","657 VAN SICLEN AVENUE",11207,718-927-2363,Permitted
"ST. MARTIN&#39;S NURSERYAND KINDERGARTEN SCHOOL- I/T","657 VAN SICLEN AVENUE",11207,718-927-2363,Permitted
"ST. PETER&#39;S  DAYCARE OF WILLIAMSBRIDGE,INC.","741 EAST 219 STREET",10467,718-547-7632,Permitted
"ST. PETER&#39;S PRESCHOOL","109 HIGHLAND PLACE",11208,718-647-1014,Permitted
"ST. THOMAS MORE PLAY  GROUP","65 EAST 89 STREET",10128,212-534-3977,Permitted
"ST.ALBANS OUTREACH DAYCARE CENTER","109-53 FARMERS BOULEVARD",11412,718-479-4111,"Expired-In Renewal"
"ST.BARTHOLOMEW COMMUNITY PRE-SCHOOL","109 EAST 50 STREET",10022,212-378-0238,Permitted
"ST.LUKE&#39;S NURSERY","87-34 85 STREET",11421,718-296-6683,"Expired-In Renewal"
"ST.MARY&#39;S HOSPITAL FOR CHILDREN","29-01 216 STREET",11360,718-281-8848,Permitted
"STAGG STREET CENTER FOR CHILDREN","77-83 STAGG STREET",11206,718-388-1395,Permitted
"STAR  AMERICA  M. INC.","780 8 AVENUE",10036,212-262-4896,Permitted
"STAR AMERICA INC.","80-07 BROADWAY",11373,718-396-9739,Permitted
"STAR AMERICA INC.","880 60 STREET",11220,718-431-2545,Permitted
"STAR AMERICA PRESCHOOL","780 8 AVENUE",10036,212-262-4896,Permitted
"STAR PARADISE, INC.","86-55 BROADWAY",11373,718-255-1899,Permitted
"STARRETT EARLY LEARNING CENTER","1325 PENNSYLVANIA AVENUE",11239,718-642-8724,Permitted
"STATEN ISLAND CHILDREN&#39;S ACADEMY","50 OSAGE LANE",10312,718-227-2500,Permitted
"STATEN ISLAND CHILDREN&#39;S ACADEMY","50 OSAGE LANE",10312,718-227-2500,Permitted
"STATEN ISLAND EARLY CHILDHOOD CENTER","467 ST MARKS PLACE",10301,718-447-7726,Permitted
"STATEN ISLAND HEAD START","44 DONGAN HILLS AVENUE",10306,718-987-7755,Permitted
"STATEN ISLAND INFANT TODDLER","145 ROSS AVENUE",10306,718-667-9235,Permitted
"STATEN ISLAND MENTAL HEALTH HEAD START","16 OSGOOD AVENUE",10304,718-420-6138,Permitted
"STATEN ISLAND MENTAL HEALTH SOCIETY HEAD START","100 BRIGHTON AVENUE",10301,718-442-6680,Permitted
"STATEN ISLAND PRESCHOOL","145 ROSS AVENUE",10306,718-667-9235,Permitted
"STATEN ISLAND Y.M.C.A. NURSERY - NORTH","651 BROADWAY",10310,718-981-4933,Permitted
"STEP AHEAD DAY CARE INFANT/ TODDLERS","7100   RIDGE BLVD.",11209,718-680-2221,Permitted
"STEP AHEAD DAY CARE(PRE-SCHOOL)","7100   RIDGE BLVD.",11209,718-680-2221,Permitted
"STEP AHEAD DCC","1677 ST. JOHN&#39;S PLACE",11233,929-234-5858,Permitted
"STEP BY STEP  INFANT DEVELOPMENT CENTER  INC.","1049 38 STREET",11219,718-633-6666,Permitted
"STEP BY STEP EARLY CHILDHOOD CENTER, INC.","1163 LENOX ROAD",11212,718-922-6366,Permitted
"STEP BY STEP EARLY CHILDHOOD CENTER, INC.","1163 LENOX ROAD",11212,718-922-6366,Permitted
"STEPHEN WISE EARLY CHILDHOOD CENTER","30 WEST 68 STREET",10023,212-877-4050,Permitted
"STEPHEN WISE EARLY CHILDHOOD CENTER","30 WEST 68TH STREET",10023,212-877-4050,Permitted
"STEPPING STONE DAY SCHOOL, INC.","2826 WESTCHESTER AVENUE",10461,718-554-2025,Permitted
"STEPPING STONE DAY SCHOOL, INC.","77-40 VLEIGH PLACE",11367,718-591-9093,Permitted
"STEPPING STONE DAYSCHOOLPRESCHOOL","77-40 VLEIGH PLACE",11367,718-591-9093,Permitted
"STEPPING STONE PRE AND GRADE SCHOOL","114-36 FRANCIS LEWIS BOULEVARD",11411,718-465-2344,Permitted
"STEPPING STONE PRE-SCHOOL","114-28 FRANCIS LEWIS BOULEVARD",11411,718-465-2344,Permitted
"STEPPING STONE PRE-SCHOOL","114-30 FRANCIS LEWIS BOULEVARD",11411,718-465-2344,Permitted
"STEPPING STONE PRE-SCHOOL AND KINDERGARTEN III","114-38 FRANCIS LEWIS BOULEVARD",11411,718-465-2344,Permitted
"STEPPING STONE PREPARATORY","900 ROGERS AVENUE",11226,718-282-7193,Permitted
"STEPPING STONES","245 86 STREET",11209,718-630-1000,Permitted
"STEPPING STONES","247 86TH STREET",11209,718-630-1000,Permitted
"STEPPING STONES PRESCHOOL","5394 AMBOY ROAD",10312,718-948-4878,Permitted
"STEPPING STONES-THE NEXT STEP","9321 RIDGE BLVD.",11209,718-630-1001,Permitted
"STEPPING UP NURSERY SCHOOL","2000 WILLIAMSBRIDGE ROAD",10461,718-828-1180,Permitted
"STEPS 2 SUCCESS","1992 NOSTRAND AVENUE",11210,718-576-6994,Permitted
"STEPS TO SUCCESS 1","11-21 NEW LOTS AVENUE",11212,718-345-3555,Permitted
"STEPS TO SUCCESS I","11-21 NEW LOTS AVENUE",11212,718-345-3555,Permitted
"STEPS TO SUCCESS II","2975 HYLAN BLVD",10306,718-351-7777,Permitted
"STEPS TO SUCCESS III","1810 VOORHIES AVENUE",11235,718-758-5558,Permitted
"STILLWELL  AVE PREP-SCHOOL","6420 BAY PARKWAY",11204,718-232-3643,Permitted
"STILLWELL AVE PREPARATORY EXTENSION PROGRAM","132 HIGHLAWN AVENUE",11223,718-333-3433,Permitted
"STILLWELL AVENUE PREP SCHOOL","1990 STILLWELL AVENUE",11223,718-265-2220,"Expired-In Renewal"
"STORYBOOK LAND","8638 20TH AVENUE",11214,718-996-8714,Permitted
"STRAWBERRY PATCH DAY CARE  INC.","2007 LINDEN BOULEVARD",11207,718-257-7555,Permitted
"STRAWBERRY PATCH DAY CARE,INC.","2007 LINDEN BOULEVARD",11207,718-257-7555,Permitted
"STRONG PLACE DAY CARE","595 CLINTON STREET",11231,718-624-2993,Permitted
"STRONG PLACE FOR HOPE DAY CARE","333 2ND STREET",11215,718-624-2993,Permitted
"STRONG PLACE FOR HOPE DAY CARE","460 ATLANTIC AVENUE",11217,718-522-1352,Permitted
"STUYVESANT HEIGHTS CHRISTIAN CHURCH EARLY CHILDHOOD CENTER","69 MACDONOUGH STREET",11216,718-783-5383,Permitted
"STUYVESANT HEIGHTS MONTESSORI","644 MACDONOUGH STREET",11233,347-295-1100,Permitted
"SUMNER CHILDREN&#39;S CENTER","860 PARK AVENUE",11206,718-455-3471,Permitted
"SUN FLOWER","121-17  SUTPHIN BLVD.",11434,718-848-1352,Permitted
"SUNFLOWER ACADEMY","238 5 AVENUE",11215,718-783-0738,Permitted
"SUNFLOWER DAY CARE CENTER","1704 BATH AVENUE",11214,718-236-3643,Permitted
"SUNFLOWER KIDZ DAY CARE","100-17 32 AVENUE",11369,347-709-7793,Permitted
"SUNFLOWER PLAYHOUSE","787A WASHINGTON AVENUE",11238,718-623-2900,Permitted
"SUNFLOWER PLAYHOUSE  #2","33 7TH   AVENUE",11217,718-638-0212,Permitted
"SUNNY SKIES PRE-SCHOOL # 2","969  43RD STREET",11219,718-438-7040,Permitted
"SUNNY SKIES PRESCHOOL","112 Ridge Street",10002,212-472-4665,Permitted
"SUNNY SKIES PRESCHOOL","2585 CONEY ISLAND AVENUE",11223,718-438-7040,Permitted
"SUNNY SKIES PROSPECT","720 WASHINGTON AVENUE",11238,718-372-4665,Permitted
"SUNNYSIDE UP UPK PROGRAM","43-31 39 STREET",11104,718-784-6173,Permitted
"SUNSET PARK CHILDREN&#39;S SCHOOL (PRESCHOOL )","4616 4 AVENUE",11220,718-439-3323,Permitted
"SUNSET PARK CHILDREN&#39;S SCHOOL, INC. I/T","4616 4TH AVENUE",11220,718-439-3323,Permitted
