"LURIA ACADEMY OF BROOKLYN","238 ST. MARKS AVENUE",11238,718-398-3290,Permitted
"M S K C C CHILDREN&#39;S CENTER","475 MAIN STREET",10044,212-224-0129,Permitted
"M. KALIX AND NATALIE LINDOR NURSERY INC. I/T","951 EAST 84TH STREET",11236,718-209-1347,Permitted
"M.S. SUNSHINE DAY CARE CENTER","3096 BRIGHTON 6TH STREET",11235,718-648-8786,Permitted
"M.S.SUNSHINE INC. ( TODDLERS)","3096 BRIGHTON 6TH STREET",11235,718-648-8786,Permitted
"MABEL  BARRETT FITZGERALD DAY CARE CENTER","243 WEST 64 STREET",10023,212-712-9308,Permitted
MACADEMY,"1313 UNION STREET",11225,718-221-5566,Permitted
"MACEDONIA CHILD DEVELOPMENT CENTER","37-22 UNION STREET",11354,718-939-6060,Permitted
"MACHNA SHALVA I","1362 49TH STREET",11219,718-436-2212,Permitted
"MACHNA SHALVA II","1363 50TH STREET",11219,718-438-0060,Permitted
"MACHZIK BRACHA LEARNING CENTER","1177 48 STREET",11219,718-972-7310,Permitted
"MADISON  PLAYGROUP","230 EAST 60TH ST",10022,212-879-9161,"Expired-In Renewal"
"MAGIC KINGDOM","5215 CHURCH AVENUE",11203,718-495-5333,Permitted
"MAGIC KINGDOM OF SHEEPSHEAD BAY","2484 EAST 18TH STREET",11235,718-648-1988,Permitted
"MAGIC YEARS INFANT/TODDLER PROGRAM","90-20 55 AVENUE",11373,718-271-1850,Permitted
"MAGIC YEARS PRE-SCHOOL","90-20 55 AVENUE",11373,718-271-1850,Permitted
"MAGICAL YEARS EARLY CHILDHOOD CENTER","230 60 STREET",11220,718-439-0450,Permitted
"MAGNA&#39;S DAY CARE CENTER","1662 CARROLL STREET",11213,718-493-8467,Permitted
"MAKING A DIFFERENCE CENTER","670 ROCKAWAY PARKWAY",11236,718-484-8110,Permitted
"MALCOLM X DAY CARE","111-12 NORTHERN BLVD",11368,718-651-7880,Permitted
"MANGO&#39;S PLACE DAY CARE CENTER","506 WASHINGTON AVENUE",11238,718-857-4250,Permitted
"MANHATTAN CHILDREN&#39;S PROGRAM, U C P OF N Y C","122 EAST 23 STREET",10010,212-677-7400,Permitted
"MANHATTAN DAY SCHOOL","310 WEST 75TH STREET",10023,212-376-6800,Permitted
"MANHATTAN DEVELOPMENT ACADEMY","541 WEST 125TH STREET",10027,212-222-6860,Permitted
"MANHATTAN KID&#39;S CLUB II, INC.","629 EAST 14 STREET",10009,212-533-1977,"Expired-In Renewal"
"MANHATTAN NURSERY SCHOOL","38 WEST 32 STREET",10001,212-631-0543,Permitted
"MANHATTAN NURSERY SCHOOL","38 WEST 32ND STREET",10001,212-631-0543,Permitted
"MARBLE HILL NURSERY SCHOOL","5470 BROADWAY",10463,718-562-7055,Permitted
"MARC ACADEMY AND FAMILY CENTER","2111 JEROME AVENUE",10453,718-562-3410,"Expired-In Renewal"
"MARCKTELL MANAGEMENT ( JFKIDS PORT)","BLDG #350 JFK AIRPORT",11430,718-553-5437,Permitted
"MARCY CHILDREN&#39;S CENTER","494 MARCY AVENUE",11206,718-855-7252,Permitted
"MARIE DURDIN CHILD CARE CENTER","2700 LINDEN BOULEVARD",11208,718-647-4730,Permitted
"MAROOS CHILD CARE CENTER","45-02 82ND STREET",11373,718-396-7479,Permitted
"MARTIN L. KING, JR. MEMORIAL DAY CARE CTR","36-06 PRINCE STREET",11354,718-886-3165,Permitted
"MARY BOBB DAY CARE,INC. #3","1289 NOSTRAND AVENUE",11226,718-693-9121,Permitted
"MARY BOBB LEARNING ACADEMY","1187 NOSTRAND AVENUE",11225,718-604-4400,Permitted
"MARY MCLEOD BETHUNE CHILD DEVELOPMENT CENTER INC.","360 PULASKI STREET",11206,718-455-5137,Permitted
"MARY WALTON CHILDREN&#39;S CENTER","224 WEST 152 STREET",10039,212-283-4242,"Expired-In Renewal"
"MARYEL INTERNATIONAL PRESCHOOL","28 EAST 35TH STREET",10016,347-667-9109,Permitted
"MASPETH TOWN HALL PRE-SCHOOL","53-37 72 STREET",11378,718-335-6049,Permitted
"MEDGAR EVERS HEAD START","60 EAST 93RD STREET",11212,718-221-2531,Permitted
"MEI  WAH  PRE-SCHOOL","69 MADISON STREET",10002,212-349-2703,Permitted
"MELISSA&#39;S CHILDREN OF TOMORROW","117-11  JAMAICA    AVE",11418,718-846-2060,Permitted
"MERCAZ GAN","2221 AVENUE R",11229,718-513-1931,Permitted
"MERKAZ-THE CENTER, INC.","1739 OCEAN AVENUE",11230,718-252-2122,Permitted
"MERRICAT&#39;S CASTLE SCHOOL","316 EAST 88 STREET",10128,212-534-3656,"Expired-In Renewal"
"METRO NORTH DAY CARE CENTER","304 EAST 102 STREET",10029,212-828-6087,"Expired-In Renewal"
"MI NUEVO MUNDO","104-19 39 AVENUE",11368,718-476-7919,Permitted
"MI NUEVO MUNDO I","51-02 31 AVENUE",11377,718-626-1686,Permitted
"MI NUEVO MUNDO III.","104-21 39 AVENUE",11368,718-476-7919,Permitted
"MI NUEVO MUNDO IV PRESCHOOL","100-03 39 AVENUE",11368,718-476-3535,Permitted
"MI NUEVO MUNDO LL","31-05 51 STREET",11377,718-626-7394,Permitted
"MI NUEVO MUNDO V P/S","100-05 39 AVENUE",11368,718-626-7394,Permitted
"MID BRONX C C R P EARLY CHILDHOOD CENTER","1020-1022 SUMMIT AVENUE",10452,347-498-1097,Permitted
"MID BRONX C C R P EARLY CHILDHOOD CENTER","1360 OGDEN AVENUE",10452,917-962-9384,Permitted
"MID BRONX CCRP EARLY CHILDHOOD CENTER","100-120 EAST MOUNT EDEN AVENUE",10452,718-583-9664,Permitted
"MID-BRONX C C R P HEAD START","1125 GRAND CONCOURSE",10452,718-590-7014,Permitted
"MIDDLETON&#39;S EARLY LEARNING CENTER","226-02 MERRICK BOULEVARD",11413,718-949-9890,Permitted
"MIDWOOD MONTESSORI","2825 BEDFORD AVENUE",11210,718-253-3242,Permitted
"MILESTONE SCHOOL FOR CHILD DEVELOPMENT","15 HANOVER PLACE",11201,347-916-0333,Permitted
"MILLER EVANGELICAL CHRISTIAN LEARNING ACADEMY","1110 PRESIDENT STREET",11225,718-363-7160,Permitted
"MINI MIRACLES CORP","1708 FLATBUSH AVENUE",11210,718-676-5377,Permitted
"MINI WORLD PRESCHOOL","7516 AMBOY ROAD",10307,718-948-9535,Permitted
"MINIVENTURES OF N Y","433 EAST 148TH STREET",10455,917-645-5214,"Expired-In Renewal"
"MINIVENTURES OF NEW YORK","433 EAST 148TH STREET",10455,917-645-5214,Permitted
"MINIVENTURES OF NY, INC.","67-52 79 STREET",11379,718-326-4500,Permitted
"MINIVENTURES OF NY, INC.","67-52 79TH STREET",11379,718-326-4500,Permitted
"MISS D&#39; PLAYGROUP","15-26 CENTRAL AVENUE",11691,718-327-3767,Permitted
"MISS FRANCINE DAY SCHOOL I I","2169 GRAND CONCOURSE",10453,718-295-3100,Permitted
"MOMMY DAYCARE","891 AVENUE Z",11235,718-339-5777,Permitted
"MONA PREP DAY CARE CENTER INC.","241-15 NORTH CONDUIT AVENUE",11422,718-525-8555,Permitted
"MONSIGNOR BOYLE HEAD START","3044 HULL AVENUE",10467,718-405-7844,Permitted
"MONTCLARE CHILDREN&#39;S SCHOOL LLC","747 AMSTERDAM AVENUE",10025,212-865-4020,Permitted
"MONTESSORI DAY SCHOOL OF BROOKLYN","237 PARK PLACE",11238,718-398-2322,Permitted
"MONTESSORI PROGRESSIVE LEARNING CENTER","195-05 LINDEN BOULEVARD",11412,718-723-3967,Permitted
"MONTESSORI SCHOOL OF MANHATTAN","2 GOLD ST.",10038,212-742-2830,Permitted
"MONTESSORI SCHOOL OF MANHATTAN","53 BEACH STREET",10013,212-334-0400,Permitted
"MONTGOMERY ACADEMY","414 UTICA AVENUE",11213,718-493-4774,Permitted
"MORNING STAR PRESCHOOL","47-24 BELL BLVD",11361,718-229-0206,Permitted
"MORNINGSIDE DAY CARE","2967 FREDERICK DOUGLAS BLVD",10039,212-281-4142,Permitted
"MORNINGSIDE MONTESSORI SCHOOL","251 WEST 100 STREET",10025,212-316-1555,Permitted
"MORRIS L. EISENSTEIN LEARNING CENTER","613 NEW LOTS AVENUE",11207,718-385-1201,Permitted
"MOSDOTH BERESHITH","1257 EAST 18TH STREET",11230,718-233-2946,Permitted
"MOSHOLU MONTEFIORE CHILD DEVELOPMENT CENTER","3880 SEDGWICK AVENUE",10463,718-654-0563,Permitted
"MOSHOLU MONTEFIORE COMMUNITY CENTER - NORTHSIDE ANNEX","3512 DEKALB AVENUE",10467,718-405-0020,"Expired-In Renewal"
"MOST TERRIFIC CHILD","555 TOMPKINS AVENUE",10305,718-273-0334,Permitted
"MOTHER LOVE","1681 49 STREET",11204,718-853-1408,Permitted
"MOTHER&#39;S CARE DAY CARE","955 NOSTRAND AVENUE",11225,347-260-6518,Permitted
"MOVING UP CHILDREN CENTER","40-69 94 STREET",11373,718-803-9788,Permitted
"MOZARTS AND EINSTEINS","910 UNION STREET",11215,347-227-8500,Permitted
"MS. ELENA&#39;S SUNSHINE EARLY LEARNING CENTER","3075 BAISLEY AVENUE",10461,718-863-6470,Permitted
"MSGR. ANDREW LANDI EARLY CHILDHOOD DEVELOPMENT CENTER","21-20 35 AVENUE",11106,718-722-6026,Permitted
"MSKCC CHILDREN&#39;S CENTER","475 MAIN STREET",10044,212-224-0129,"Expired-In Renewal"
"MT.OLIVET CHRISTIAN SCHOOL.","33-25 97 STREET",11368,718-478-0780,Permitted
"MUNCHKIN LAND LTD","4712 AVENUE N",11234,718-338-3820,Permitted
"MUSHROOM  HOUSE","38-00 DITMARS BLVD.",11105,718-606-6161,Permitted
"MY LITTLE FOOTPRINTS DAY CARE","28-34 38 STREET",11103,718-626-2201,Permitted
"MY LITTLE LANGUAGE SCHOOL","225  WEST 99TH STREET",10025,646-389-7552,Permitted
"MY LITTLE SCHOOL","291 BROADWAY (ENTRANCE 54 READE STREET)",10007,212-566-6764,Permitted
"MY LITTLE VILLAGE","33 AVENUE A",10009,212-253-2430,Permitted
"MY SUNSHINE 11,INC.","3096 BRIGHTON 6TH STREET",11235,718-648-8786,"Expired-In Renewal"
"MYRTLE P. JARMON ECEC","116-55 GUY R. BREWER BLVD.",11434,718-528-0922,Permitted
"NASRY MICHELEN DAY CARE CENTER, INC.","510 WEST 145 STREET",10031,212-690-3290,Permitted
"NAT AZAROW CHILDREN&#39;S CENTER","232 POWELL STREET",11212,718-346-0924,Permitted
"NATIONAL ASSOCIATION OF FAMILY SERVICE","2960 WEST 27 STREET",11224,917-821-5714,Permitted
"NAYEMA UNIVERSAL CHILD CARE CENTER INC.","1107-09 NEWKIRK AVENUE",11230,718-462-3688,Permitted
"NAZARETH EARLY CHILDHOOD CENTER","475 EAST 57 STREET",11203,718-451-5213,Permitted
"NAZARETH NURSERY","214-16 WEST 15 STREET",10011,212-243-1881,Permitted
"NELRAK CHILD DEVELOPMENT CENRTER-INFANT/TODDLER","1057 FULTON STREET",11238,718-230-0011,"Expired-In Renewal"
"NELRAK CHILD DEVELOPMENT CENTER-PRESCHOOL","1057 FULTON STREET",11238,718-230-0011,Permitted
"NESHAMA PRESCHOOL","2997 OCEAN PARKWAY",11235,718-946-9833,Permitted
"NEW AGE DAY CARE CENTER","538 JAMAICA AVENUE",11208,718-277-3434,Permitted
"NEW AMSTERDAM EARLY CHILDHOOD CENTER","1 AVENUE B",10009,212-982-1400,Permitted
"NEW DEAL DAY CARE AND LEARNING CENTER, INC.","172-12 JAMAICA AVENUE",11432,718-739-2177,Permitted
"NEW DISCOVERIES DAY CARE CENTER","803 EAST 163RD STREET",10456,718-542-2100,Permitted
"NEW GENERATION ACADEMY","4701 AVENUE J",11234,718-252-0160,Permitted
"NEW GENERATIONS LEARNING CENTER, INC.","2597 BEDFORD AVENUE",11226,718-941-0404,Permitted
"NEW GRACE CENTER","650 LIVONIA AVENUE",11207,718-498-7175,Permitted
"NEW HOPE DAY CARE, INC. (I/T)","1481 NOSTRAND AVENUE",11226,718-284-5923,Permitted
"NEW HOPE DAY CARE,INC. (P.S.)","1481 NOSTRAND AVENUE",11226,718-284-5923,Permitted
"NEW LIFE CHILD DEVELOPMENT CENTER INC.","295 WOODBINE STREET",11237,718-821-3433,Permitted
"NEW LIFE CHILD DEVELOPMENT CENTER INC.","406 GROVE STREET",11237,718-381-8969,Permitted
"NEW LIFE DAY CARE CENTER, INC.","406-408 GROVE STREET",11237,718-417-4206,Permitted
"NEW LIFE HEAD START","1307 GREENE AVENUE",11237,718-366-1668,Permitted
"NEW LIFE IN CHRIST MINISTRIES","814 MARCY AVENUE",11216,718-783-3555,Permitted
"NEW MILESTONE","132-54 POPLE AVENUE",11355,718-539-2068,"Expired-In Renewal"
"NEW MILESTONE DAY CARE CENTER","158-13 72 AVENUE",11365,718-380-1978,Permitted
"NEW MILLENIUM DAY SCHOOL, INC.","172-07 JAMAICA AVENUE",11432,347-561-7169,Permitted
"NEW PRIDE DAY CARE CENTER","1636 BROADWAY",11207,718-453-0204,Permitted
"NEW WORLD EDUCATIONAL CENTER","137-37 FARMERS BOULEVARD",11434,718-528-8751,Permitted
"NEW WORLD EDUCATIONAL PROGRAM","137-37 FARMERS BLVD.",11434,718-658-3030,Permitted
"NEW YORK  KIDS CLUB","182-184 HENRY STREET",11201,718-228-0800,Permitted
"NEW YORK CENTER FOR CHILD DEVELOPMENT","159  WEST 127TH STREET",10027,212-752-7564,Permitted
"NEW YORK CENTER FOR INFANTS AND TODDLERS","2336 ANDREWS AVENUE",10468,718-561-5300,Permitted
"NEW YORK CENTER FOR INFANTS AND TODDLERS, INC.","1787 MADISON AVENUE",10035,212-289-6100,Permitted
"NEW YORK CHILD LEARNING INSTITUTE","14-02 124 STREET",11356,718-445-0752,Permitted
"NEW YORK CHILD RESOURCE CENTER INC.","348 EAST 146TH STREET",10451,718-585-0600,Permitted
"NEW YORK CHILD RESOURCE CENTER INC.","706 QUINCY STREET",11221,718-443-3440,Permitted
"NEW YORK CREATIVE CHILDCARE","5015 6TH AVENUE",11220,718-686-0388,Permitted
"NEW YORK LEAGUE FOR EARLY LEARNING CLEARVIEW SCHOOL","124-06 14TH AVENUE",11356,718-352-0104,Permitted
"NEW YORK UNITED DAY CARE","349 KEAP STREET",11211,718-302-4400,Permitted
"NEXT 2 HOME CHILD CARE","1159 FLATBUSH AVENUE",11226,347-221-0275,Permitted
"NEXT TO HOME CHILD CARE","353 OCEAN AVENUE",11226,347-484-2311,"Expired-In Renewal"
"NICHOLAS CARDELL DAY CARE CENTER","84 VERMILYEA AVENUE",10034,212-942-6757,"Expired-In Renewal"
"NIGHTINGALE DAY CARE CENTER","462 LENOX RD",11203,718-510-4428,Permitted
"NO. BX. NATIONAL COUNCIL OF NEGRO WOMEN CHILD DEV. CENTER","4035 WHITE PLAINS ROAD",10466,718-231-7100,Permitted
"NOAH&#39;S ARK DAY CARE CENTER","120 VERMILYEA AVENUE",10034,212-942-4775,Permitted
"NOAH&#39;S ARK NU GENERATION, DAYCARE, INC.","4716 AVENUE N",11234,718-253-5950,Permitted
"NOAH&#39;S ARK PROGRESSIVE LEARNING CENTER II","62-48 MT. OLIVET CRESCENT",11379,347-335-0044,Permitted
"NOAH&#39;S ARK PROGRESSIVE LEARNING CENTER INC.","38-20 BELL BOULEVARD",11361,718-279-4251,Permitted
"NORTH SIDE SCHOOL","84-60 PARSONS BLVD.",11432,718-298-6161,Permitted
"NORTHERN CONVENT AVENUE EARLY CHILDHOOD PROGRAM","764 ST. NICHOLAS AVENUE",10031,212-234-1036,Permitted
"NORTHSIDE CENTER  FOR DEVELOPMENT -  HEAD START","302 EAST 111TH STREET",10029,646-351-1300,Permitted
"NORTHSIDE CENTER FOR CHILD DEVELOPMENT - ACS HEAD START","302-306 EAST 111TH STREET",10029,646-351-1300,Permitted
"NORTHSIDE CENTER FOR CHILD DEVELOPMENT - BRONX EARLY HEAD START","609 EAST 156TH STREET",10455,347-926-5400,Permitted
"NORTHSIDE CENTER FOR CHILD DEVELOPMENT, INC.- EARLY HEAD START","302-306 EAST 111TH STREET",10029,646-351-1300,Permitted
"NORTHSIDE CENTER FOR CHILD DEVELOPMENT-BRONX EARLY HEADSTART","609 EAST 156TH STREET",10455,347-926-5400,Permitted
"NORTHSIDE SCHOOL","16-50 UTOPIA PARKWAY",11357,718-229-5050,Permitted
"NORTHSIDE THERAPEUTIC  E C C","1301 5 AVENUE",10029,212-426-3400,Permitted
"NUESTROS NINOS C. D. SCHOOL","384 SOUTH 4 STREET",11211,718-963-1555,Permitted
"NUESTROS NINOS CDS @WILLIAMSBURG DAY CARE","243 SOUTH 2ND STREET",11211,718-218-8275,Permitted
"NUESTROS NINOS DAY CARE CENTER 111","161 SOUTH 3 STREET",11211,718-388-5000,Permitted
"NURSERY NORTH INFANT &amp; CHILD CARE CENTER ( INFANT PROGRAM )","2094  FREDRICK DOUGLAS BLVD",10026,212-222-4404,Permitted
"NURSERY NORTH INFANT &amp; CHILD DAYCARE CENTER","2094 FREDRICK DOUGLAS BLVD.",10026,212-222-4404,Permitted
"NURSERY NORTH TOO","249 WEST 144TH STREET",10030,212-926-9700,Permitted
"NURSERY NORTH TOO","249 WEST 144TH STREET",10030,212-926-9700,Permitted
"NURSERY SCHOOL AT HABONIM","44 WEST 66 STREET",10023,212-787-5347,Permitted
"NY CITY EXPLORERS","110 SCHERMERHORN ST.",11201,718-797-3707,Permitted
"OAKDALE ACADEMY INFANT TODDLER PROGRAM","366 OAKDALE STREET",10312,718-948-4220,Permitted
"OAKDALE ACADEMY PRESCHOOL","366 OAKDALE STREET",10312,718-948-4220,Permitted
"OAKWOOD HEIGHTS COMMUNITY CHURCH NURSERY SCHOOL","345 GUYON AVE.",10306,718-351-0984,Permitted
"ODYSSEY HOUSE FAMILY CENTER","219 EAST 121 ST",10035,212-987-5193,Permitted
"ODYSSEY HOUSE FAMILY CENTER","219 EAST 121 ST",10035,212-987-5193,Permitted
"OHR OSHER AND YAFFA JEWISH CENTER","75-21 MAIN STREET",11367,718-850-2934,Permitted
"OLD FIRST NURSERY SCHOOL","729 CARROLL STREET",11215,347-460-6367,"Expired-In Renewal"
"OMEGA/PSI/PHI/FRAT/NY OMICRON2","123-10 143 STREET",11436,718-322-9671,Permitted
"ON OUR WAY LEARNING CENTER","264 BEACH 19 STREET",11691,718-868-2961,Permitted
"ONCE UPON A TIME","68-05 64TH PLACE",11385,347-529-6718,Permitted
"ONCE UPON ATIME,INC.","87-61 111 STREET",11418,718-846-9182,Permitted
"ONE WORLD PROJECT","1218 PROSPECT AVENUE",11218,718-407-6377,Permitted
"OPEN DOOR CHILD CARE CENTER","820 COLUMBUS AVENUE",10025,212-749-5572,"Expired-In Renewal"
"OPEN HOUSE NURSERY SCHOOL","318A WARREN STREET",11201,718-625-5252,Permitted
"OTSAR EARLY CHILDHOOD CENTER","2324 WEST 13TH STREET",11223,718-946-1413,Permitted
"OUR CHILDREN OUR FUTURE CHILD CARE CENTER INFANT/TODDLER","306 MILLER AVENUE",11207,718-385-6745,"Expired-In Renewal"
"OUR CHILDREN OUR FUTURE CHILD CARE CENTER PRESCHOOL","306 MILLER AVENUE",11207,718-385-6745,Permitted
"OUR CHILDREN&#39;S CENTER","55 JOHNSON ST.",11201,718-260-5192,Permitted
"OUR CHILDREN&#39;S CENTER - PRESCHOOL","300 JAY STREET",11201,718-260-5192,Permitted
"OUR CHILDREN-THE LEADERS OF TOMORROW","756  MYRTLE AVENUE",11206,718-643-8201,Permitted
"OUR KIDS PLACE COUNTRY DAY","137-25 BROOKVILLE BLVD",11422,516-805-4202,Permitted
"OUR LADY QUEEN OF MARTYRS  HEAD START/UPK","71-91 ARDEN STREET",10040,646-796-1398,Permitted
"OUR LITTLE ANGELS CORP","86-29 COMMONWEALTH BLVD",11426,718-347-7377,Permitted
"OUR P.L.A.C.E. SCHOOL","329 NORWAY AVENUE",10305,718-987-9400,Permitted
"OUR SAVIOUR LUTHERAN PRE-SCHOOL","90-04 175 STREET",11432,718-739-7452,Permitted
"OUR SAVIOUR LUTHERAN PRESCHOOL","64-33  WOODHAVEN BLVD",11374,718-897-4343,Permitted
"OUR SAVIOUR&#39;S LUTHERAN PRE-SCHOOL","414-420 80 STREET",11209,718-745-0020,Permitted
"P R O M E S A MULTICULTURAL D C  I I","300 EAST 175TH STREET",10457,347-649-3209,Permitted
"P.A.L./W.O.C.E. HEAD START","280 LIVONIA AVENUE",11212,718-345-5219,Permitted
"PACCOR PRESCHOOL","118-17 GUY R BREWER BOULEVARD",11434,718-525-9620,Permitted
"PADRE KENNEDY EARLY CHILDHOOD  DEVELOPMENT CENTER","243 SOUTH 2ND STREET",11211,718-388-3434,Permitted
"PAERDEGAT DAY SCHOOL (PRE-SCHOOL)","1500 PAERDEGAT AVENUE NORTH",11236,718-531-1111,Permitted
"PAERDEGAT INFANT/TODDLER","1500 PAERDEGAT AVENUE NORTH",11236,718-531-1111,Permitted
"PAL  A &amp; M SCHWARTZ  EARLY LEARN CENTER","454 PENNSYLVANIA AVE",11207,718-342-4724,Permitted
"PAL CAREY GARDENS DAY CARE CENTER","2964 WEST 23 STREET",11224,718-372-4044,Permitted
"PAL WESTERN QUEENS EARLY LEARNING CENTER","10-26 41 AVE",11101,718-784-2092,Permitted
"PAMELA C. TORRES DAY CARE CENTER","161 ST. ANN&#39;S AVENUE",10454,718-585-2540,Permitted
"PARADISE DAY CARE CENTER","528 EAST 95 STREET",11212,718-385-0571,Permitted
"PARENT PLUS OF ST. ALBANS","195-15 LINDEN BLVD.",11412,718-977-8555,Permitted
"PARK AVENUE CHRISTIAN CHURCH DAY SCHOOL","4 WEST 76TH STREET",10023,212-288-3247,Permitted
"PARK AVENUE METHODIST CHURCH DAY SCHOOL","106 EAST 86 STREET",10028,212-289-6997,Permitted
"PARK AVENUE SYNAGOGUE EARLY CHILDHOOD CENTER","50 EAST 87 STREET",10128,212-369-2600,Permitted
"PARK PLACE DAY CARE CENTER","963 PARK PLACE",11213,718-778-8558,Permitted
"PARK PLACE DAY CARE,INC.","738 NOSTRAND AVENUE",11216,347-627-3955,Permitted
"PARK PLACE DAYCARE","822-828 PARK PLACE",11216,347-627-3955,Permitted
"PARK SLOPE CHILD CARE COLLECTIVE","186 ST. JOHN&#39;S PLACE",11217,718-399-0397,Permitted
"PARK SLOPE SCHOOLHOUSE CHILD CARE CENTER , INC. INFANT/TODDLER","558  5TH AVENUE",11215,718-768-4873,Permitted
"PARK SLOPE SCHOOLHOUSE CHILD CARE CENTER, INC.","558  5TH AVENUE",11215,718-768-4873,Permitted
"PARK WEST MONTESSORI SCHOOL, INC.","435 CENTRAL PARK WEST",10025,212-678-6072,Permitted
"PARK WEST MONTESSORI SCHOOL,INC.","435 CENTRAL PARK WEST",10025,212-678-6072,"Expired-In Renewal"
"PARKER&#39;S PLACE","428 7TH AVENUE",11215,718-499-2080,Permitted
"PARKSIDE EARLY CHILDHOOD DEVELOPMENT CENTER","525 PARKSIDE AVENUE",11226,929-210-9200,Permitted
"PARKWAY PRESCHOOL","5566 KINGS HIGHWAY",11203,718-346-0369,Permitted
"PARSONS PRESCHOOL","231-10 HILLSIDE AVENUE",11427,718-464-5606,Permitted
"PARSONS PRESCHOOL","84-60 PARSONS BOULEVARD",11432,718-298-6161,Permitted
"PATRICIA CARBINE CHILDREN&#39;S CENTER","51 MADISON AVENUE",10010,212-576-3444,Permitted
"PATRICIA CARBINE CHILDREN&#39;S CENTER","51 MADISON AVENUE",10010,212-576-3444,Permitted
"PAUL T. MATSON HEAD START","1244 MANOR AVENUE",10472,718-328-8547,Permitted
"PAUL T. MATSON HEAD START # 1","1951 WASHINGTON AVENUE",10457,718-299-2112,Permitted
"PAUL T. MATSON HEAD START #5","1780 STORY AVENUE",10473,718-328-5470,"Expired-In Renewal"
"PB CHILDREN&#39;S ACACEMY","3506 CHURCH AVENUE",11203,718-941-1102,Permitted
"PB CHILDREN&#39;S ACADEMY - (PRE-SCHOOL)","3504 CHURCH AVENUE",11203,718-941-1102,Permitted
"PB CHILDREN&#39;S ACADEMY - I/T","3506 CHURCH AVENUE",11203,718-941-1102,Permitted
"PEACEFUL EXPLORERS","1113 PRESIDENT STREET",11225,718-483-8528,Permitted
"PEARTREE PRESCHOOL","132 WEST 112TH  STREET",10026,212-866-4105,Permitted
"PEE WEE FOLKS","12-45 CLINTONVILLE ST",11357,718-746-6107,Permitted
"PEOPLE&#39;S  DAY CARE CENTER","121 RIVERDALE AVENUE",11212,718-346-0089,"Expired-In Renewal"
"PERLA&#39;S DAYCARE CENTER","2167 CONEY ISLAND AVENUE",11223,718-336-1044,Permitted
"PERSONAL TOUCH EARLY CHILDHOOD CENTER","158-13 72 AVENUE",11365,718-380-7600,Permitted
"PFIZER  KIDS","235 EAST 42ND STREET",10017,212-733-5040,Permitted
"PFIZER  KIDS P/S","235 EAST 42 STREET",10017,212-733-5040,Permitted
"PHEBEANA PRE-SCHOOL, INC.","160 PARKSIDE AVENUE",11226,718-284-8147,Permitted
"PHILIP H. MICHAELS  CHILD DEVELOPMENT CENTER","629 COURTLANDT AVENUE",10451,718-665-9410,Permitted
"PHIPPS HEAD START","921 EAST 180 STREET",10460,718-364-2496,Permitted
"PHIPPS LAMBERT HEAD START","1005 EAST 179TH STREET",10460,718-842-3633,Permitted
"PHYL&#39;S ACADEMY","3520 TILDEN AVENUE",11203,718-469-9400,Permitted
"PICK WICK SCHOOL, INC./PICK WICK SCHOOL","151-15 85 DRIVE",11432,718-526-1340,Permitted
"PICKWICK SCHOOL, INC. INFANT/TODDLER","151-15 85 DRIVE",11432,718-526-1340,Permitted
"PINE STREET DAY CARE CENTER","374 PINE STREET",11208,718-235-1150,Permitted
"PINOCCHIO CHILDREN&#39;S PALACE","900 LENOX ROAD",11203,718-618-7330,Permitted
"PINOCCHIO CHILDREN&#39;S PALACE","900 LENOX ROAD",11203,718-618-7330,Permitted
"PLAY &amp; LEARN PRESCHOOL CENTER","66-06 70 ST",11379,718-894-0016,"Expired-In Renewal"
"PLAYMATES NURSERY","131-13 LIBERTY AVENUE",11419,718-845-4973,Permitted
"PLAYMATES NURSERY","131-15 LIBERTY AVENUE",11419,718-845-4973,Permitted
"PLAYMATES NURSERY INC","126-18 111 AVENUE",11420,718-738-8203,Permitted
"PLEASANT LEARN-N-PLAY CENTER, INC.","126-03 MERRICK BOULEVARD",11434,718-525-5272,Permitted
"PLYMOUTH CHURCH SCHOOL","75 HICKS STREET",11201,718-624-9385,Permitted
"POLSKIE PRZEDSZKOLE","4105 FORT HAMILTON PARKWAY",11219,718-633-9389,Permitted
"PONO LEARNING","2002 FIFTH AVENUE",10035,917-912-4323,Permitted
"PORT RICHMOND DAY NURSERY HEAD START","166 LOCKMAN AVENUE",10303,718-494-0400,Permitted
"POSITIVE BEGINNINGS # 1","71-25 MAIN STREET",11367,718-261-0211,Permitted
"POSITIVE BEGINNINGS, INC","72-52 METROPOLITAN AVENUE",11379,718-326-0055,Permitted
"PRACTICAL LEARNING CENTER","527 EASTERN PARKWAY",11216,718-773-5070,Permitted
"PRACTICAL LEARNING CENTER (P/S)","22-32 BUCKINGHAM ROAD",11226,718-282-4200,Permitted
"PRACTICAL LEARNING CENTER, INC.","1283 OCEAN AVENUE",11230,718-434-5583,Permitted
"PRE SCHOOL OF AMERICA","112-33 QUEENS BLVD",11375,718-261-2522,"Expired-In Renewal"
"PRE SCHOOL OF AMERICA","63-47 BOOTH STREET",11374,718-896-8108,Permitted
"PRE-SCHOOL MINDS  DAY CARE CENTER","3316 CHURCH AVENUE",11203,718-284-9392,Permitted
"PRE-SCHOOL MINDS DAY CARE CENTER","3318 CHURCH AVENUE",11203,718-284-9392,Permitted
"PRE-SCHOOL OF AMERICA,LLC","1501 LEXINGTON AVE",10029,212-987-3700,"Expired-In Renewal"
"PRECIOUS CHILDREN DAY CARE CENTER  INC#2","202-13 JAMAICA AVENUE",11423,718-479-2127,Permitted
"PRECIOUS CHILDREN DAY CARE CENTER INC.","202-11 JAMAICA AVENUE",11423,718-479-2127,Permitted
"PRECIOUS EARLY CHILDHOOD ACADEMY","9624 KINGS HIGHWAY",11212,718-495-2269,Permitted
"PRECIOUS GIFT DAY CARE, INC.","317 ALBANY AVENUE",11213,718-773-7311,Permitted
"PRECIOUS MEMORIES DAY CARE, INC.","3124 CHURCH AVENUE",11226,718-287-0037,Permitted
"PRECIOUS MOMENTS NURSERY &amp; PRE-K","61-28 GRAND AVENUE",11378,718-416-1624,Permitted
"PRECIOUS MOMENTS NURSERY SCHOOL  &amp; PRE-K","61-28 GRAND AVENUE",11378,718-416-1624,"Expired-In Renewal"
"PRECIOUS MOMENTS NURSERY SCHOOL &amp; DAY CARE CENTER INC.","11-02 CLINTONVILLE STREET",11357,718-767-6655,Permitted
"PRECIOUS MOMENTS NURSERY SCHOOL&amp;D.C.,INC.","11-02 CLINTONVILLE STREET",11357,718-767-6655,"Expired-In Renewal"
PRESCHOOL,"443 TARGEE STREET",10304,718-727-2724,Permitted
"PRESCHOOL OF AMERICA","101 WEST END AVENUE",10069,212-362-0135,Permitted
"PRESCHOOL OF AMERICA","1180-90 PARK AVENUE",10128,212-410-1100,Permitted
"PRESCHOOL OF AMERICA","1180-90 PARK AVENUE",10128,212-410-1100,Permitted
"PRESCHOOL OF AMERICA","1501 LEXINGTON AVE",10029,212-987-3700,"Expired-In Renewal"
"PRESCHOOL OF AMERICA","186-01 73RD  AVENUE",11366,718-380-2066,Permitted
"PRESCHOOL OF AMERICA","186-01 73RD  AVENUE",11366,718-380-2866,Permitted
"PRESCHOOL OF AMERICA","2109 BROADWAY",10023,212-877-1388,Permitted
"PRESCHOOL OF AMERICA","2109 BROADWAY",10023,212-877-1388,Permitted
"PRESCHOOL OF AMERICA","25 TUDOR CITY PLACE",10017,212-681-4671,Permitted
"PRESCHOOL OF AMERICA","345 WEST 42ND STREET",10036,212-262-4545,"Expired-In Renewal"
"PRESCHOOL OF AMERICA","382 BALTIC  STREET",11201,718-855-2889,Permitted
"PRESCHOOL OF AMERICA","39 ELDRIDGE STREET",10002,212-925-0998,Permitted
"PRESCHOOL OF AMERICA","42-31 COLDEN STREET",11355,718-762-1232,Permitted
"PRESCHOOL OF AMERICA","44-46 MARKET STREET",10002,212-346-9868,"Expired-In Renewal"
"PRESCHOOL OF AMERICA","600 6TH AVENUE",10011,212-255-6911,"Expired-In Renewal"
"PRESCHOOL OF AMERICA","600 6TH AVENUE",10011,212-255-6911,"Expired-In Renewal"
"PRESCHOOL OF AMERICA","63-47 BOOTH STREET",11374,718-896-8108,Permitted
"PRESCHOOL OF AMERICA","83-04 BROADWAY",11373,718-458-9656,Permitted
"PRESCHOOL OF AMERICA","83-38 CORNISH AVE",11373,718-458-9656,"Expired-In Renewal"
"PRESCHOOL OF AMERICA","83-38 CORNISH AVENUE",11373,718-458-9656,Permitted
"PRESCHOOL OF AMERICA","859 60TH  STREET",11220,718-686-8335,Permitted
"PRESCHOOL OF AMERICA","859 60TH  STREET",11220,718-686-8335,Permitted
"PRESCHOOL OF AMERICA  I/T","101 WEST END AVENUE",10069,212-362-0135,Permitted
"PRESCHOOL OF AMERICA  INFANT/ TODDLER","382 BALTIC  STREET",11201,718-855-2889,Permitted
"PRESCHOOL OF AMERICA (USA), INC.","44-46 MARKET STREET",10002,212-346-9868,Permitted
"PRESCHOOL OF AMERICA ,LLC (INFANT PROGRAM)","25 TUDOR CITY PLACE",10017,212-681-4671,Permitted
"PRESCHOOL OF AMERICA INFANT/TODDLER","112-33 QUEENS BLVD",11375,718-261-2522,"Expired-In Renewal"
"PRESCHOOL OF AMERICA,LLC","345 WEST 42ND STREET",10036,212-262-4545,Permitted
"PRESCHOOL OF THE ARTS @ COOPER SQUARE","41 COOPER SQUARE",10003,917-701-4925,Permitted
"PRESCHOOL OF THE ARTS ANNEX","121 WEST 19TH STREET",10011,212-229-9075,Permitted
"PRESCHOOL R&#39; US","150-15 41ST AVENUE",11354,718-888-1958,Permitted
"PRESCHOOL R&#39; US II","59-25 KISSENA BLVD.",11355,718-888-9878,Permitted
