"DOWNING STREET PLAYGROUP","32 CARMINE STREET",10014,212-924-2557,Permitted
"DOWNTOWN  LITTLE  SCHOOL","15 DUTCH STREET",10038,212-791-1300,Permitted
"DR C.R. JOHNSON CHRISTIAN DAY CARE","600 LAFAYETTE AVENUE",11216,718-732-1531,"Expired-In Renewal"
"DR. KATHARINE DODGE BROWNELL SCHOOL","450 CASTLE HILL AVENUE",10473,718-430-7938,Permitted
"DREAMLAND DAY CARE CENTER","1379 WEST 7TH STREET",11204,718-232-8155,Permitted
"DUFFIELD CHILDREN&#39;S CENTER","101 FLEET PLACE",11201,718-522-5296,Permitted
"DUFFIELD CHILDREN&#39;S CENTER HEAD START PROGRAM","101 FLEET PLACE",11201,718-522-5296,Permitted
"DWIGHT EARLY CHILDHOOD DIVISION","140  RIVERSIDE BLVD",10069,212-362-2350,Permitted
"EARLY CHILDHOOD LEARNING CENTER PROGRAMS","31-10 THOMSON AVENUE",11101,718-482-5295,Permitted
"EARLY LIFE","110 WEST 146TH STREET",10039,646-478-7949,Permitted
"EARLY LIFE","1175 GATES AVENUE",11221,212-870-1100,Permitted
"EARLY LIFE","151-157 WEST 136TH STREET",10030,212-933-1815,Permitted
"EARLY LIFE","200 WEST TREMONT AVENUE",10453,917-962-4344,Permitted
"EARLY LIFE","2125 WATSON AVENUE",10472,718-943-0580,Permitted
"EARLY LIFE","218 WEST 147TH STREET",10039,646-360-4093,Permitted
"EARLY LIFE","265 MARCUS GARVEY BLVD.",11221,347-689-8303,Permitted
"EARLY LIFE","510-516 WEST 145TH STREET",10031,646-449-0814,Permitted
"EARLY LIFE","80 EAST 181ST STREET",10453,718-365-6247,Permitted
"EARLY LIFE","888 WESTCHESTER AVENUE",10459,718-450-3556,Permitted
"EARLY SUNRISE PRESCHOOL AND KINDERGARTEN","187-08 HILLSIDE AVENUE",11432,718-736-9064,Permitted
"EARLY SUNRISE PRESCHOOL&amp;KINDERGARTEN,INC.","187-10 HILLSIDE AVENUE",11432,718-736-9064,Permitted
"EAST BRONX DAY CARE","1113 COLGATE AVENUE",10472,718-617-2900,Permitted
"EAST CALVARY DAY CARE CENTER INC.","1 WEST 112 STREET",10026,212-534-5249,Permitted
"EAST CHELSEA CHILDRENS WORKSHOP","17 EAST 16 STREET",10003,212-691-8964,Permitted
"EAST HARLEM BILINGUAL   HEAD START","440 EAST 116 STREET",10029,212-427-9010,Permitted
"EAST HARLEM BLOCK  NURSERY #2","2112 MADISON AVENUE",10037,212-234-3333,Permitted
"EAST HARLEM BLOCK NURSERY #1","215 EAST 106 STREET",10029,212-427-2571,Permitted
"EAST HARLEM BLOCK NURSERY/GRANT DAY CARE CENTER","1299 AMSTERDAM AVENUE",10027,212-666-6000,Permitted
"EAST HARLEM COUNCIL FOR HUMAN SERVICES INC.BILINGUAL HEAD START","30 EAST 111 STREET",10029,212-860-7201,Permitted
"EAST MIDWOOD HEBREW DAY SCHOOL","1256 EAST 21 STREET",11210,718-253-1555,Permitted
"EAST RIVER CHILD DEVELOPMENT CENTER","570 GRAND STREET",10002,212-254-7301,"Expired-In Renewal"
"EAST RIVER CHILD DEVELOPMENT CENTER","577 GRAND STREET",10002,212-254-7300,Permitted
"EAST SIDE HOUSE SETTLEMENT HEAD START/DAY CARE","201 ST. ANN&#39;S AVENUE",10454,718-993-4854,Permitted
"EAST SIDE HOUSE SETTLEMENT HEAD START/DAY CARE","375 EAST 143RD STREET",10454,718-292-5335,Permitted
"EAST SIDE SETTLEMENT HOUSE HEAD START/ DAY CARE","414 MORRIS AVENUE",10451,718-401-4242,Permitted
"EAST TREMONT CHILD CARE AND DEVELOPMENT CENTER","1811 CROTONA AVENUE",10457,718-731-4166,Permitted
"EAST TREMONT HEAD START ALUMNI DCC, INC./ PAUL T. MATSON HEAD START SITE I I I","2431 MORRIS AVENUE",10468,718-563-5139,Permitted
"EAST VILLAGE CHILD CARE CENTER","297 EAST 10 STREET",10009,212-982-8701,Permitted
"EASTER SEALS CHILD DEVELOPMENT CENTER","2433 EAST TREMONT AVENUE",10461,718-409-4227,Permitted
"ECDO  CHILDSTART CENTER","249 WEST 144TH STREET",10030,212-234-8135,Permitted
"EDEN CHRISTIAN ACADEMY &amp; EARLY CHILDHOOD CENTER","1509 MORRIS AVENUE",10457,718-684-2962,"Expired-In Renewal"
"EDUCATIONAL ALLIANCE  HEAD START","333 EAST 4 STREET",10009,212-254-2614,Permitted
"EDWARDS L. CLEAVELAND DAY CARE CENTER","1185 PARK PLACE",11213,718-778-6559,Permitted
"EFFIE B&#39;S EARLY CHILDHOOD DEVELOPMENT CENTER","1173 EASTERN PARKWAY",11213,718-735-5500,Permitted
"EFFIE B&#39;S EARLY CHILDHOOD DEVELOPMENT CENTER, PRESCHOOL","1173 EASTERN PARKWAY",11213,718-735-5500,Permitted
"EL SHADDAI INTERNATIONAL","1475 HAMMERSLEY AVENUE",10469,718-515-5004,Permitted
"ELADIA&#39;S  KIDS","266 FLATBUSH AVENUE",11217,718-230-7560,Permitted
"ELADIA&#39;S KIDS","147 5TH AVENUE",11217,718-622-3316,Permitted
"ELADIA&#39;S KIDS","175 VANDERBILT AVENUE",11205,718-230-7560,Permitted
"ELADIA&#39;S KIDS","175 VANDERBILT AVENUE",11205,718-522-6361,Permitted
"ELADIA&#39;S KIDS","266 FLATBUSH AVENUE",11217,718-230-7560,Permitted
"ELADIA&#39;S KIDS PRESCHOOL","147 5TH AVENUE",11217,718-633-3316,Permitted
"ELF DAY CARE CENTER","550 OCEAN PARKWAY",11218,718-871-4301,Permitted
"ELF SERVICES DAY CARE CENTER","550 OCEAN PARKWAY",11218,718-871-4301,Permitted
"ELISHAMA CHILDREN&#39;S PREP SCHOOL","206-18 HOLLIS AVENUE",11429,718-468-8744,Permitted
"ELITE DAY CARE LEARNING CENTER","4239 RICHMOND AVENUE",10312,718-608-1833,Permitted
"ELITE DAY CARE LEARNING CENTER","990 HYLAN BLVD",10305,718-448-5075,Permitted
"ELIZABETH SETON PRE-SCHOOL","245 EAST 92ND  STREET",10128,212-369-9626,Permitted
"ELLA BAKER / CHARLES ROMAIN CHILD DEVELOPMENT CENTER","1150 CARROLL STREET",11225,718-270-6017,"Expired-In Renewal"
"EMMANUEL DAY CARE CENTER KINDERGARTEN","279 LAFAYETTE AVENUE",11238,718-622-1233,Permitted
"EPIPHANY COMMUNITY NURSERY SCHOOL","510 EAST 74TH STREET",10021,212-737-2977,Permitted
"EPISCOPAL SOCAL SERVICES EARLY HEADSTART","500 BERGEN AVENUE",10455,718-401-5192,Permitted
"EPISCOPAL SOCIAL SERVICE THERAPEUTIC NURSERY SCHOOL","2289 5TH AVENUE",10037,212-283-3100,Permitted
"EPISCOPAL SOCIAL SERVICES EARLY HEAD START","500 BERGEN AVENUE",10455,718-401-5192,Permitted
"EPISCOPAL SOCIAL SERVICES/LENOX AVENUE","669 LENOX AVENUE",10037,212-491-8501,Permitted
"ESCALERA HEAD START","169 WEST 87TH STREET",10024,212-799-2440,Permitted
"ESCUELA HISPANA  MONTESSORI","180 SUFFOLK STREET",10002,212-982-6650,Permitted
"ESCUELA HISPANA MONTESSORI HEAD START","185 AVENUE D",10009,212-982-6651,Permitted
"ESS WILLIAMSBURG EARLY CHILDHOOD DEVELOPMENT CENTER","110 TAYLOR STREET",11249,347-943-7682,Permitted
"ESTHER  ASHKENAS CENTRAL PARK EARLY LEARNING CENTER","15 WEST 65TH STREET",10023,212-787-5400,Permitted
"EUREKA NURSERY &amp; DAY CARE","2502 CLARENDON ROAD",11226,718-284-2155,Permitted
"EXCEL  PRESCHOOL INFANT/TODDLER PROGRAM","2144 RICHMOND AVENUE",10314,718-370-3784,Permitted
"EXCEL PRESCHOOL","2144 RICHMOND AVENUE",10314,718-370-3784,Permitted
"F.V.M. BETHEL DAY CARE (I/T)","1120 FLATBUSH AVENUE",11226,718-824-1809,Permitted
"F.V.M. BETHEL DAY CARE (P.S.)","1120 FLATBUSH AVENUE",11226,718-284-1809,Permitted
"FACES OF THE FUTURE DAY CARE CENTER, LLC","5302 CLARENDON RD",11203,718-451-9474,Permitted
"FACES OF THE FUTURE EARLY LEARNING CENTER, LLC.","1080 UTICA AVENUE",11203,646-409-8030,Permitted
"FAITH CHRISTIAN ACADEMY","1137 EAST 223 STREET",10466,718-881-1085,Permitted
"FALU  FOUNDATION","333 EAST 118 STREET",10035,212-828-6699,Permitted
"FAMILY  SCHOOL  WEST","308 WEST 46 STREET",10036,212-582-1240,Permitted
"FAMILY CENTER AT BROOKLYN FRIENDS","189 SCHERMERHORN STREET",11201,718-852-1029,Permitted
"FAMILY HEAD START","293 NEPTUNE AVENUE",11235,718-332-8524,Permitted
"FAMILY HEAD START","3017 GLENWOOD ROAD",11210,718-859-7720,Permitted
"FAMILY HEAD START/ EARLY LEARN","8885 26 AVENUE",11214,718-258-7767,Permitted
"FANTASIA DAY CARE CENTER","2743 OCEAN AVENUE",11229,718-646-6738,Permitted
"FARBER-BRUCH EARLY CHILDHOOD CENTER","7802 BAY PARKWAY",11214,718-943-6333,Permitted
"FED KIDS CHILD CARE CENTER, MANAGED BY BRIGHT HORIZONS","26 FEDERAL PLAZA",10007,212-264-4277,Permitted
"FED KIDS CHILD CARE CENTER, MANAGED BY BRIGHT HORIZONS","26 FEDERAL PLAZA",10007,212-264-4277,Permitted
"FIAF A PETIS PAS PRESCHOOL","22 EAST 60TH STREET",10022,212-355-6100,Permitted
"FINGER PAINTED HANDS PRESCHOOL","126 WEST 83RD STREET",10024,212-595-5200,Permitted
"FIRST  PRESBYTERIAN CHURCH","41-54 MURRAY STREET",11355,718-359-3993,Permitted
"FIRST CHOICE ACADEMY DAY CARE, INC.","192 EAST 58TH STREET",11203,718-451-3565,Permitted
"FIRST FRIENDS PRE-SCHOOL","245 WEST 74 STREET",10023,212-769-1088,Permitted
"FIRST IMPRESSIONS NURSERY SCHOOL","2513 BEDFORD AVENUE",11226,718-469-9792,"Expired-In Renewal"
"FIRST IMPRESSIONS NURSERY SCHOOL","776 ROGERS AVENUE",11226,718-462-5009,"Expired-In Renewal"
"FIRST PRESBYTERIAN CHURCH NURSERY SCHOOL","12 WEST 12 STREET",10011,212-691-3432,Permitted
"FIRST STAR DAY CARE LEARNING CENTER - INFANT/TODDLER","145-88 GUY R BREWER BOULEVARD",11434,718-528-3363,Permitted
"FIRST STEPPING STONES","4017 CHURCH AVENUE",11203,347-309-9493,Permitted
"FIRST STEPS AT CLINTON","19 CLINTON STREET",10002,212-792-5770,"Expired-In Renewal"
"FIRST STEPS AT CLINTON","19 CLINTON STREET",10002,212-792-5770,Permitted
"FIRST STEPS DAY CARE CENTER","15 EAST CLARKE PLACE",10452,347-591-3711,Permitted
"FIRSTSTEPNYC@PS/IS 41","411 THATFORD STREET",11212,347-758-0433,Permitted
"FIRSTSTEPNYC@PS41FRANCIS WHITE","411 THATFORD AVENUE",11212,718-485-0295,Permitted
"FIVE STAR DAY CARE CENTER","3261 3 AVENUE",10456,718-292-4774,Permitted
"FLUSHING YMCA EARLY CHILDHOOD PROGRAM","138-46 NORTHERN BOULEVARD",11354,718-551-9356,Permitted
"FOOTSTEPS CHILDCARE INC.","1125 BROADWAY",11221,718-443-0236,Permitted
"FOOTSTEPS CHILDCARE INC.","1125 BROADWAY",11221,718-443-0236,Permitted
"FOR KIDS ONLY  DAY CARE","902 MORRIS PARK AVENUE",10462,718-823-8345,Permitted
"FOR KIDS ONLY DAY CARE","900 MORRIS PARK AVENUE",10462,718-823-8345,Permitted
"FOR KIDS ONLY DAY CARE","902 MORRIS PARK AVENUE",10462,718-823-8345,Permitted
"FOR KIDS ONLY DAY CARE","904 MORRIS PARK AVENUE",10462,718-823-8345,Permitted
"FOREST HILLS JEWISH CENTER NURSERY SCHOOL AND KINDERGARTEN","106-06 QUEENS BOULEVARD",11375,718-263-7000,Permitted
"FOREST HILLS MONTESSORI","67-04 AUSTIN STREET",11375,718-275-0173,Permitted
"FOREST HILLS NURSERY AND KINDERGARTEN","108-56 69 AVENUE",11375,718-544-3692,Permitted
"FOREST HILLS WEST SCHOOL","63-25 DRY HARBOR ROAD",11379,718-639-9750,Permitted
"FOREVER YOUNG DAY CARE, INC.","4503 AVENUE D",11203,718-451-5050,Permitted
"FORT GREENE CHILDREN &amp; FAMILY SERVICES EARLY HEAD START","44-60 ROCKWELL PLACE",11217,347-505-5500,Permitted
"FORT GREENE CHILDREN&#39;S &amp; FAMILY SERVICES HEAD START","44-60 ROCKWELL PLACE",11217,347-505-5500,Permitted
"FRANCIS CHILD CARE FACILITY","38-03 FRANCIS LEWIS BLVD.",11358,718-229-5357,Permitted
"FRANCIS GRACE DAYCARE","130-20 MERRICK BOULEVARD",11434,718-977-1853,Permitted
"FRIENDS AND FAMILY DAY CARE","1677 LEXINGTON AVENUE",10029,212-534-7160,Permitted
"FRIENDS AND FAMILY DAY CARE","1677 LEXINGTON AVENUE",10029,212-534-7160,Permitted
"FRIENDS OF CROWN HEIGHT EDUCATIONAL CENTERS","3732 10TH AVENUE",10034,212-567-5655,Permitted
"FRIENDS OF CROWN HEIGHTS EDUCATIONAL CENTER","1491 BEDFORD AVENUE",11216,929-234-2821,Permitted
"FRIENDS OF CROWN HEIGHTS EDUCATIONAL CENTER","20 SUTTER AVENUE",11212,718-773-3041,Permitted
"FRIENDS OF CROWN HEIGHTS EDUCATIONAL CENTER","370 NEW LOTS AVENUE",11207,718-342-3700,Permitted
"FRIENDS OF CROWN HEIGHTS EDUCATIONAL CENTER","813 STERLING PLACE",11216,718-773-7733,Permitted
"FRIENDS OF CROWN HEIGHTS EDUCATIONAL CENTER","851 LIBERTY AVENUE",11208,929-234-2955,Permitted
"FRIENDS OF CROWN HEIGHTS EDUCATIONAL CENTER","921 HEGEMAN AVENUE",11208,929-234-2866,Permitted
"FRIENDS OF CROWN HEIGHTS EDUCATIONAL CENTER","995 CARROLL STREET",11225,929-234-5010,Permitted
"FRIENDS OF CROWN HEIGHTS EDUCATIONAL CENTER","995 CARROLL STREET",11225,929-234-5010,Permitted
"FRIENDS OF CROWN HEIGHTS EDUCATIONAL CENTER  #6","49 AVENUE W",11223,718-372-8189,Permitted
"FRIENDS OF CROWN HEIGHTS EDUCATIONAL CENTER #2","671 PROSPECT PLACE",11216,718-638-8686,Permitted
"FRIENDS OF CROWN HEIGHTS EDUCATIONAL CENTER #2","671-675 PROSPECT PLACE",11216,718-638-8686,Permitted
"FRIENDS OF CROWN HEIGHTS EDUCATIONAL CENTER #4 INFANT/TODDLER","141 EAST 40TH STREET",11203,718-284-2184,Permitted
"FRIENDS OF CROWN HEIGHTS EDUCATIONAL CENTER #4 PRESCHOOL","141 EAST 40TH STREET",11203,718-284-2184,Permitted
"FRIENDS OF CROWN HEIGHTS EDUCATIONAL CENTER, NO. 5","1886 NOSTRAND AVENUE",11226,718-284-9194,Permitted
"FRIENDS OF CROWN HEIGHTS EDUCATIONAL CENTERS","1435 PROSPECT PLACE",11213,718-778-1498,Permitted
"FRIENDS OF CROWN HEIGHTS EDUCATIONAL CENTERS","2505 PITKIN AVENUE",11208,929-234-2850,Permitted
"FRIENDS OF CROWN HEIGHTS EDUCATIONAL CENTERS","668 LOGAN STREET",11208,929-324-2870,Permitted
"FRIENDS OF CROWN HEIGHTS EDUCATIONAL CENTERS","737 EAST 6TH STREET",10009,646-438-9289,Permitted
"FRIENDS OF REFUGEES OF EASTERN EUROPE - F.R.E.E.","2901 BRIGHTON 6 STREET",11235,718-368-4490,Permitted
"FRIENDS PRESCHOOL &amp; DAY CARE","610 BLOOMINGDALE ROAD",10309,718-984-5194,Permitted
"FT. GEORGE HEAD START  CENTER 1","1525 ST NICHOLAS AVENUE",10033,212-927-2210,Permitted
"FT. GEORGE HEAD START CENTER  II","601 WEST 186TH  STREET",10033,212-927-2210,Permitted
"FULL GOSPEL CHRISTIAN ACADEMY","836 FRANKLIN AVENUE",11225,718-774-2121,Permitted
"FUTURE LEADERS CENTER INC","133-13 ROCKAWAY BOULEVARD",11420,718-529-8127,Permitted
"FUTURE STARS DAY CARE","5410 AVENUE N",11234,917-974-2751,Permitted
"FUTURE STARS DAY CARE CENTER.","1196 NOSTRAND AVENUE",11225,718-778-8966,Permitted
"G S U C  CHILD DEVELOPMENT AND LEARNING CENTER","365 5 AVENUE",10016,212-817-7032,Permitted
"GAN DAY CARE CENTER","4206-10 15 AVENUE",11219,718-435-2812,Permitted
"GAN EDEN  PRESCHOOL","131 WEST 86 STREET",10024,212-579-3096,"Expired-In Renewal"
"GAN EDEN PRE-SCHOOL","78-15 PARSONS BOULEVARD",11366,718-591-0783,Permitted
"GAN JEWISH DAY CARE CENTER","2901 CAMPUS ROAD",11210,718-338-7575,Permitted
"GAN MIRIAM EARLY LEARNING CENTER","3700 INDEPENDENCE AVE",10463,718-543-2553,Permitted
"GARDEN HOUSE SCHOOL CHILD CARE CENTER","39 EAST 63RD STREET",10065,212-421-5095,"Expired-In Renewal"
"GARDEN HOUSE SCHOOL OF NEW YORK (PRE-SCHOOL)","40 SUTTON PLACE",10022,212-421-3282,"Expired-In Renewal"
"GARDEN OF KNOWLEDGE DAY CARE &amp; LEARNING CENTER","1657 NOSTRAND AVENUE",11226,718-469-2229,Permitted
"GARDEN OF LEARNING DAY CARE","834 PROSPECT PLACE",11216,718-778-0996,Permitted
"GARDEN SCHOOL","33-16 79 STREET",11372,718-335-6363,"Expired-In Renewal"
"GARMENT INDUSTRY DAY CARE CENTER","115 CHRYSTIE STREET",10002,212-219-2286,Permitted
"GENERATION 21","6709 19 AVENUE",11204,718-621-9321,Permitted
"GENERATION 21 INFANT/TODDLER","6709 19TH AVENUE",11204,718-621-9321,Permitted
"GEORGIA L. MC MURRAY BATKIDS CENTER","140 58TH STREET",11220,718-567-0818,Permitted
"GET SET  KINDERGARTEN SCHOOL- AVENUE D","4411 AVENUE D",11203,718-451-5378,Permitted
"GET SET KINDERGARTEN - CORTELYOU PRESCHOOL","1919 CORTELYOU ROAD",11226,718-856-4646,Permitted
"GET SET KINDERGARTEN SCHOOL","623 LINDEN BOULEVARD",11203,718-774-2325,Permitted
"GET SET KINDERGARTEN SCHOOL - AVENUE D - INFANT","4411 AVENUE D",11203,718-451-5378,Permitted
"GET SET KINDERGARTEN SCHOOL-","2301 SNYDER AVENUE",11226,718-469-0135,Permitted
"GET SET KINDERGARTEN SCHOOL- PRESCHOOL (SNYDER)","2301 SNYDER AVENUE",11226,718-469-0135,Permitted
"GET SET KINDERGARTEN SCHOOL- PRESCHOOL- (LINDEN)","623 LINDEN BOULEVARD",11203,718-774-2325,Permitted
"GET SET KINDERGARTEN- INFANT/TODDLERS CORTELYOU","1919 CORTELYOU ROAD",11226,718-856-4646,Permitted
"GIL-BLU NURSERY AND KINDERGARTEN","120-02 MERRICK BOULEVARD",11434,718-723-8454,Permitted
"GLORIOUS &amp; GIFTED EARLY CHILDHOOD CENTER","421 THROOP AVENUE",11221,347-620-4316,Permitted
"GNOMIKI DAY CARE","2221 OCEAN AVENUE",11229,718-336-0249,Permitted
"GODDARD RIVERSIDE DAY CARE CENTER","114 WEST 91 STREET",10024,212-873-6865,"Expired-In Renewal"
"GODDARD RIVERSIDE HEAD START","70 WEST 95 STREET",10025,212-749-2133,Permitted
"GODDARD-RIVERSIDE COMMUNITY CENTER DAY CARE CENTER AT 84TH STREET","26 WEST 84TH STREET",10024,212-799-2369,Permitted
"GOLD MATERIAL MONTESSORI SCHOOL","105  KINGS HIGHWAY",11214,718-253-2552,Permitted
"GOLD MATERIAL MONTESSORI SCHOOL","41 AVENUE B",10009,212-545-0061,Permitted
"GOLD MATERIAL MONTESSORI SCHOOL","484 SECOND AVE.",10016,212-545-0061,"Expired-In Renewal"
"GOLDEN DAISIES PREP","2307 AVENUE D",11226,718-469-7530,Permitted
"GOOD FOUNDATION KINDERGARTEN","196-02A LINDEN BOULEVARD",11412,718-712-1500,Permitted
"GOOD FOUNDATION PRESCHOOL","196-04 LINDEN BOULEVARD",11412,718-712-1500,Permitted
"GOOD FOUNDATION PRESCHOOL","196-08 LINDEN BOULEVARD",11412,718-712-1500,Permitted
"GOOD SAMARITAN FULTON DAY CARE CENTER - INFANT/TODDLER","992 GATES AVENUE",11221,718-443-6463,Permitted
"GOOD SAMARITAN FULTON DAY CARE CENTER-PRESCHOOL","992 GATES AVENUE",11221,718-443-6463,Permitted
"GRACE CHURCH PLAYSCHOOL","151-17 14 ROAD",11357,718-767-2162,Permitted
"GRACE CHURCH SCHOOL","254 HICKS STREET",11201,718-624-4030,Permitted
"GRACE DAY CARE CENTER","89-00 23 AVENUE",11369,718-803-0345,Permitted
"GRACE LUTHERAN CHURCH","31-20 21 AVENUE",11105,718-545-1129,Permitted
"GRACE NURSERY SCHOOL.","7604 4TH AVENUE",11209,718-238-7980,Permitted
"GRAND ST SETTLEMENT EARLY HEAD START","80 PITT STREET",10002,212-674-1740,Permitted
"GRAND ST. SETTLEMENT DUAL I","60 ESSEX STREET",10002,212-677-6990,Permitted
"GRAND STREET CHILD CARE CENTER","300 DELANCEY STREET",10002,212-228-8240,Permitted
"GRAND STREET SETTLEMENT EARLY HEAD START","80 PITT STREET",10002,212-674-1740,Permitted
"GRAND STREET SETTLEMENT HEAD START","294 DELANCEY STREET",10002,212-777-0656,Permitted
"GRAND STREET SETTLEMENT, INC.","319 STANHOPE STREET",11237,718-381-8900,Permitted
"GREAT BEGINNINGS INFANT &amp; TODDLER CENTER","2221 RICHMOND AVENUE",10314,718-983-0014,Permitted
"GREAT BEGINNINGS INFANT/TODDLER CENTER","2221 RICHMOND AVENUE",10314,718-983-0014,Permitted
"GREATER BRIGHT LIGHT LEARNING CENTER","1320 SUTTER AVENUE",11208,718-235-2003,Permitted
"GREENPOINT Y.M.C.A. NURSERY SCHOOL","99 MESEROLE AVENUE",11222,718-389-3700,Permitted
"GROSVENOR  NEIGHBORHOOD  HOUSE YMCA - TENDER CARE","176 WEST 105 STREET",10025,212-749-8500,Permitted
"GROW WITH US - SUSAN E. WAGNER DAY SCHOOL","1732 DAVIDSON AVE",10453,718-299-6892,Permitted
"GRYC LITTLE STARS PRE-K","62-81 60TH PLACE",11385,718-456-5437,Permitted
"GRYC LITTLE STARS PRE-SCHOOL","59-03 SUMMERFIELD STREET",11385,718-456-5437,Permitted
"GRYC LITTLE STARS UPK @PANCRAS","68-20 MYRTLE AVENUE",11385,718-456-5437,Permitted
"GUNHILL CHILD CARE","934 EAST GUNHILL ROAD",10469,718-654-8085,Permitted
"GUNHILL CHILD CARE","934 EAST GUNHILL ROAD",10469,718-654-8085,Permitted
"GWENDOLYN B. BLAND DAY CARE CENTER","749 EAST 163RD STREET",10456,718-991-1050,Permitted
"GYMTIME RHYTHM  AND GLUES","1520 YORK AVENUE",10028,212-734-0922,"Expired-In Renewal"
"H V G PLAYGROUP","116 PINEHURST AVENUE",10033,212-923-7800,Permitted
"H.E.L.P. USA BRONX CROTONA DAY CARE","785 CROTONA PARK NORTH",10460,718-583-1511,Permitted
"H.H DAY CARE ANNEX, INC.","212-47 JAMAICA AVENUE",11428,718-776-7690,Permitted
"H.H. DAYCARE ANNEX INC.","188-32 JAMAICA AVENUE",11423,718-454-0452,Permitted
HABITOT,"3480 THIRD AVENUE",10456,718-484-8779,Permitted
HABITOT,"3480 THIRD AVENUE",10456,718-484-8779,Permitted
"HAMILTON  MADISON HOUSES CHILD CARE CENTER","10 CATHERINE SLIP",10038,212-608-9186,"Expired-In Renewal"
"HAMILTON - MADISON HOUSE CHILD CARE CENTER","253 SOUTH STREET",10002,212-406-7570,"Expired-In Renewal"
"HAMILTON MADISON HOUSE  CHILD CARE CENTER","60 CATHERINE STREET",10038,212-962-3408,"Expired-In Renewal"
"HAMILTON MADISON HOUSE CHILD CARE CENTER","129 FULTON STREET",10038,212-962-3408,Permitted
"HAMILTON MADISON HOUSE HEAD START","77 MARKET STREET",10002,212-349-8290,Permitted
"HAMMEL CHILD CARE CENTER","82-10 ROCKAWAY BEACH BOULEVARD",11693,718-474-3162,Permitted
"HAN-I PRESCHOOL","198-18 32ND ROAD",11358,718-358-3377,Permitted
"HAND IN HAND EARLY CHILDHOOD CENTER","465 GRAND STREET",10002,212-420-1989,Permitted
"HANDS &amp; HEARTS LEARNING CENTER","564 THOMAS S BOYLAND STREET",11212,718-385-1718,Permitted
"HANOVER PLACE CHILD CARE","25 HANOVER PLACE",11201,347-916-0333,Permitted
"HANOVER PLACE CHILD CARE CENTER LLC-I/T","15 HANOVER PLACE",11201,347-916-0333,Permitted
"HANOVER PLACE CHILDCARE PRESCHOOL","15 HANOVER PLACE",11201,347-916-0333,Permitted
"HANSON PLACE CHILD DEVELOPMENT CENTER","55 HANSON PLACE",11217,718-237-4303,Permitted
"HANSON PLACE CHILD DEVELOPMENT CENTER","55 HANSON PLACE",11217,718-237-4303,Permitted
"HAPPY 1  DAYCARE","48-06 212 STREET",11364,718-229-1910,Permitted
"HAPPY DAYS  AT RIVERDALE","2975 INDEPENDENCE AVENUE",10463,718-601-1300,Permitted
"HAPPY DRAGON CHILDREN AND FAMILY CENTER","5805 7TH AVENUE",11220,718-439-8816,Permitted
"HAPPY DRAGON CHILDREN&#39;S LEARNING CENTER","98-25 HORACE HARDING EXPRESSWAY",11368,718-271-5637,Permitted
"HAPPY DRAGON CHILDREN&#39;S LEARNING CENTER #2","143-30 CHERRY AVENUE",11355,718-445-8382,Permitted
"HAPPY DRAGON DAYCARE CENTER","86-02 57 AVENUE",11373,718-397-5733,Permitted
"HAPPY DRAGON PRESCHOOL","30-04 146 STREET",11354,718-446-9021,Permitted
"HAPPY HOME ACADEMY","9102 CHURCH AVENUE",11236,718-346-5327,Permitted
"HAPPY MARY ANN DAY SCHOOL","132-18 41ST    AVENUE",11355,718-886-8266,Permitted
"HAPPYLAND MANHATTAN BEACH DAY SCHOOL","190 EXETER STREET",11235,718-648-0531,"Expired-In Renewal"
"HARLEM GEMS HEAD START","60 WEST 117 STREET",10026,212-369-3577,"Expired-In Renewal"
"HAWTHORNE CORNERS DAY CARE CENTER","1950 BEDFORD AVENUE",11225,718-282-7200,Permitted
"HCHC INC A.C.E. PRESCHOOL","1441 BROADWAY",11221,718-443-3423,Permitted
"HCHC INC.","624 SCHENECTADY AVENUE",11203,718-773-7652,Permitted
"HCHC, INC.","585 SCHENECTADY AVENUE",11203,718-604-5283,Permitted
"HEART SHARE HUMAN SERVICES OF NEW YORK PRE-SCHOOL 2","82-12 151 AVENUE",11414,718-848-0300,Permitted
"HEART SHARE SERVICES OF NEW YORK PRESCHOOL 1","115-15 101 AVENUE",11419,718-441-5333,Permitted
"HEARTSHARE HUMAN SERVICES OF NEW YORK","1825 BATH AVENUE",11214,718-238-4637,Permitted
"HEAVENLY MIRACLE  ACADEMY SERVICES","533 BLAKE AVENUE",11207,718-495-9383,Permitted
"HEAVENLY MIRACLE ACADEMY SERVICES,INC..","533 BLAKE AVENUE",11207,718-495-9383,Permitted
"HEBREW ACADEMY FOR SPECIAL CHILDREN","1311 55 STREET",11219,718-851-6100,Permitted
"HEBREW ACADEMY FOR SPECIAL CHILDREN (P/S)","555 REMSEN AVENUE",11236,718-495-3510,Permitted
"HEBREW EDUCATIONAL SOCIETY","9502 SEAVIEW AVENUE",11236,718-241-3000,Permitted
"HEBREW INSTITUTE FOR THE DEAF AND EXCEPTIONAL CHILDREN","1401 AVENUE I",11230,718-377-7507,Permitted
"HEBREW INSTITUTE FOR THE DEAF AND EXCEPTIONAL CHILDREN","1401 AVENUE I",11230,718-377-7507,Permitted
"HELEN KELLER SERVICES FOR THE BLIND  CHILDREN&#39;S LEARNING CENTER","57 WILLOUGHBY STREET",11201,718-522-2122,Permitted
"HELEN OWEN CAREY CHILD DEVELOPMENT CENTER","71 LINCOLN PLACE",11217,718-638-4100,Permitted
"HELP 3 CROTONA EARLY LEARN","785 CROTONA PARK NORTH",10460,718-583-1511,Permitted
"HELP DAY CARE CORP.","515 BLAKE AVENUE",11207,718-498-4002,Permitted
"HELP MORRIS EARLY CHILDHOOD PROGRAM","285 EAST 171 STREET",10457,718-583-0174,Permitted
"HELP MORRIS EARLY CHILDHOOD PROGRAM","285 EAST 171 STREET",10457,718-583-0174,Permitted
"HELPING HANDS CHILDREN&#39;S DAY CARE CENTER, INC.","225-16 LINDEN BOULEVARD",11411,718-527-6258,Permitted
"HELPING HANDS DAY CARE","188-32 JAMAICA AVENUE",11423,718-454-0452,Permitted
"HENFIELD - PARKCHESTER CHILDREN&#39;S CENTER","1489 METROPOLITAN AVENUE",10462,718-409-1231,Permitted
"HENFIELD/PARKCHESTER CHILDREN&#39;S CENTER","2119 STARLING AVENUE",10462,718-409-1231,Permitted
"HENRY ST SETTLEMENT","301 HENRY STREET",10002,212-253-1595,Permitted
"HENRY STREET SETTLEMENT","110 BARUCH DRIVE",10002,212-614-0537,Permitted
"HERBERT G. BIRCH EARLY CHILDHOOD CENTER","475 WEST 250 STREET",10471,718-549-4753,Permitted
"HIGH DEFINITION KIDS DAY CARE CENTER","639 REMSEN AVENUE",11236,718-240-9300,Permitted
"HIGH HOPES OF S. I. INC / INFANT/TODDLER","1298 WOODROW ROAD",10309,718-317-8143,Permitted
"HIGH HOPES OF S. I. INC. PRESCHOOL","1298 WOODROW ROAD",10309,718-317-8143,Permitted
"HIGHBRIDGE ADVISORY COUNCIL  EARLY CHILDHOOD CENTER # 1","1594-98 TOWNSEND AVENUE",10452,718-299-3917,Permitted
"HIGHBRIDGE ADVISORY COUNCIL DAY CARE CENTER","1181 NELSON AVENUE",10452,718-681-5216,Permitted
"HIGHBRIDGE ADVISORY COUNCIL DORIS E. STONE CHILD CARE CENTER","1165 UNIVERSITY AVENUE",10452,718-681-5888,Permitted
"HIGHBRIDGE ADVISORY COUNCIL ECC # 3","1399 OGDEN AVENUE",10452,718-293-9196,Permitted
"HIGHBRIDGE ADVISORY COUNCIL HEAD START","880 RIVER AVENUE",10452,718-992-1321,Permitted
"HIGHBRIDGE ADVISORY COUNCIL MARSHALL ENGLAND EARLY LEARNING CENTER","800 CONCOURSE VILLAGE EAST",10451,718-742-2367,Permitted
"HIGHER LEVEL DAY CARE","2401 BEVERLY ROAD",11226,718-856-4064,Permitted
"HIGHLIGHTS ACADEMY","1688  PRESIDENT STREET",11213,718-953-5555,Permitted
"HOLLINGWORTH PRESCHOOL","525  WEST 120TH STREET",10027,212-678-3848,Permitted
"HOLLIS FORDE","212-47 JAMAICA AVENUE",11428,718-776-7690,Permitted
"HOLLIS HILLS JEWISH CENTER NURSERY SCHOOL","210-10 UNION TURNPIKE",11364,718-776-3500,Permitted
"HOLMES TOWERS EISMAN DAY NURSERY","1794 FIRST AVENUE",10128,212-876-9200,Permitted
"HOLY MOUNTAIN NURSERY #1","41-05 45 STREET",11104,718-361-0080,Permitted
"HOLY MOUNTAIN NURSERY #4","45-08 SKILLMAN AVENUE",11104,718-361-0080,Permitted
"HOLY MOUNTAIN NURSERY #5","29-49 137 STREET",11354,718-762-2700,Permitted
"HOME SWEET HOME CHILDREN&#39;S SCHOOL,INC.","196-17 53 AVENUE",11365,718-357-9738,"Expired-In Renewal"
"HOMES FOR THE HOMELESS, INC.","175-15 ROCKAWAY BOULEVARD",11434,718-244-0670,Permitted
"HONEYDEW DROP PLAYHOUSE","1113  CHURCH AVENUE",11218,718-941-2177,Permitted
"HONEYPOT DAY CARE, INC.","140-22  BEECH AVENUE",11355,718-539-2388,Permitted
"HOREB DAY CARE CENTER","520 KINGSTON AVENUE",11225,718-771-0849,Permitted
"HOSPITAL CLINIC ACE INTEGRATION HEAD START","1419-23 BROADWAY",11221,718-443-3917,Permitted
"HOSPITAL CLINIC HOME CENTER","165 EAST 46 STREET",11203,718-604-5283,"Expired-In Renewal"
"HOSTOS COMMUNITY COLLEGE CHILDREN&#39;S CENTER, INC.","475 GRAND CONCOURSE",10451,718-518-4176,Permitted
"HOUR CHILDREN INC.","36-11 11 STREET",11106,718-937-4454,Permitted
"HOUR CHILDREN, INC.","36-11 11 STREET",11106,718-937-4454,Permitted
"HOWARD BEACH JUDEA","162-05 90 STREET",11414,718-845-9443,Permitted
"HUDSON GUILD CLINTON","410 WEST 40TH STREET",10018,646-649-2351,Permitted
