Site_ID,Center_Name,Permit_Holder,Address,Borough,Zip_Code,Phone,Permit_Number,Permit_Expiration_Date,Permit_Status,Age_Range,Maximum_Capacity,Certified_to_Administer_Medication,Site_Type,Number_Of_Violations,Hazard_Violations,Critical_Violations,General_Violations,Number_Of_Visits
DC15225,KIDSMART A LEARNING CHILD CARE CENTER,THE KIDSMART GROUP LLC,360  SEAVIEW AVENUE,STATEN ISLAND,10305,718-226-8308,7631,2015-09-01,Permitted,0 YEARS - 2 YEARS,27,No,Private,14,6,2,6,11
DC18116,KIDSPIRATION DAY CARE,LISSETTE CORNICK,3501-3503 QUENTIN ROAD,BROOKLYN,11234,347-587-7920,7889,2014-06-30,Permitted,2 YEARS - 5 YEARS,25,No,Private,21,3,8,10,7
DC308,KIDZ KORNER DAY CARE,KIDZ KORNER DAY CARE,2422 RALPH AVENUE,BROOKLYN,11234,718-676-5200,7311,2014-09-30,Permitted,2 YEARS - 5 YEARS,25,No,Private,25,6,9,10,10
DC21934,"KIDZ VILLAGE, LLC","KIDZ VILLAGE,LLC",82-02 GRAND AVENUE,QUEENS,11373,718-639-5439,19318,2014-07-23,Permitted,2 YEARS - 5 YEARS,38,No,Private,6,2,1,3,5
DC22429,KIDZ WORLD EARLY CHILDHOOD CTR (I/T),"KIDZ WORLD EARLY CHILDHOOD CENTER,INC.",217-21 MERRICK BLVD.,QUEENS,11413,646-670-7582,21237,2014-08-22,Permitted,0 YEARS - 2 YEARS,25,No,Private,0,0,0,0,5
DC22401,KIDZ WORLD EARLY CHILDHOOD CTR (PRE/SCH),"KIDZ WORLD EARLY CHILDHOOD CTR,INC",217-21 MERRICK BLVD.,QUEENS,11413,646-670-7582,21317,2014-08-22,Permitted,2 YEARS - 5 YEARS,79,No,Private,0,0,0,0,6
DC11749,"KIMRICK DAYCARE & LEARNING CENTER, LLC","KIMRICK DAYCARE & LEARNING CENTER, LLC",1509 NOSTRAND AVENUE,BROOKLYN,11226,646-393-9181,7722,2015-02-26,Permitted,2 YEARS - 5 YEARS,22,No,Private,28,2,10,16,10
DC229,KIND START PRE-SCHOOL,LISA ASSENNATA,7702 NEW UTRECHT AVENUE,BROOKLYN,11214,718-621-5382,6802,2014-07-20,Permitted,2 YEARS - 5 YEARS,30,No,Private,8,0,0,8,6
DC25982,KINDERLAND DAY CARE / PRESCHOOL,KINDERLAND DAY CARE INC.,1637 45TH STREET,BROOKLYN,11204,718-871-7432,53178,2015-10-17,Permitted,2 YEARS - 5 YEARS,38,No,Private,3,0,1,2,1
DC22952,"KINDERLAND DAY CARE, INC.","KINDERLAND DAY CARE, INC.",1637 45TH STREET,BROOKLYN,11204,718-871-7432,53177,2015-10-17,Permitted,0 YEARS - 2 YEARS,26,No,Private,5,1,3,1,1
DC21601,KINDERSTUFF I,KINDER STUFF 1 LLC,2989 NOSTRAND AVENUE,BROOKLYN,11229,347-492-4877,8361,2015-08-19,Permitted,2 YEARS - 5 YEARS,67,No,Private,50,10,24,16,9
DC21606,KINDERSTUFF VI,KINDERSTUFF VI LLC,3301 FOSTER AVENUE,BROOKLYN,11203,347-663-5508,8297,2015-05-02,Permitted,2 YEARS - 5 YEARS,24,No,Private,46,7,24,15,9
DC11765,KING O'S DAY CARE CENTER,"KINGO'S DAY CARE,INC.",1097 CLARKSON AVENUE,BROOKLYN,11212,718-346-2067,7821,2015-10-12,Permitted,2 YEARS - 5 YEARS,32,No,Private,22,2,11,9,8
DC23130,KINGBRIDGE MONTESSORI SCHOOL,"JASMINE EDUCATIONAL ENTERPRISE, INC.",2500 JEROME AVENUE,BRONX,10468,718-561-8111,56457,2016-01-31,Permitted,2 YEARS - 5 YEARS,30,No,Private,0,0,0,0,0
DC25239,KINGS BAY YM-YWHA,KINGS BAY YM-YWHA INC.,14 HOPE STREET,BROOKLYN,11211,718-407-6388,52499,2015-09-26,Permitted,2 YEARS - 5 YEARS,27,No,Private,0,0,0,0,3
DC2684,KINGS BAY YM-YWHA NURSERY SCHOOL,KINGS BAY YM-YWHA INC.,3495 NOSTRAND AVENUE,BROOKLYN,11229,718-648-7703,4518,2015-11-21,Permitted,2 YEARS - 5 YEARS,47,No,Private,16,3,9,4,6
DC22936,KINGS HIGHWAY PREPARATORY SCHOOL,VALERIE MCDONALD,9218 KINGS HIGHWAY,BROOKLYN,11212,718-498-3690,17297,2016-05-29,Permitted,2 YEARS - 5 YEARS,21,No,Private,5,1,2,2,4
DC11780,"KINGS WAY EARLY CHILDHOOD CENTER,INC.","KINGS WAY EARLY CHILDHOOD CENTER,INC.",1742 EAST 18 STREET,BROOKLYN,11229,718-336-1599,7545,2015-11-28,Permitted,2 YEARS - 5 YEARS,55,No,Private,12,2,5,5,7
DC1983,"KINGSBRIDGE HEIGHTS  COMMUNITY CENTER, INC.","KINGSBRIDGE HEIGHTS COMMUNITY CENTER, INC.",3101 KINGSBRIDGE TERRACE,BRONX,10463,718-884-0700,4727,2015-08-16,Permitted,2 YEARS - 5 YEARS,62,No,ACS Contracted Preschools,12,5,2,5,7
DC22832,KINGSBRIDGE HEIGHTS COMMUNITY CENTER,"KINGSBRIDGE HEIGHTS COMMUNITY CENTER, INC.",295 WEST 231ST STREET,BRONX,10463,718-690-9466,51679,2015-09-06,Permitted,2 YEARS - 5 YEARS,80,No,ACS Contracted Preschools,3,2,1,0,1
DC401,KINGSTON KIDS LITTLE CASTLE,SILVIO REYES,70  KINGSTON AVENUE,BROOKLYN,11213,718-363-9792,8018,2015-06-15,Permitted,2 YEARS - 5 YEARS,20,No,Private,57,4,43,10,18
DC22602,KISSENA CHERRY DAY CARE,KISSENA CHERRY DAY CARE INC.,140-26 CHERRY AVE.,QUEENS,11355,718-886-2889,29078,2014-12-12,Permitted,0 YEARS - 2 YEARS,11,No,Private,0,0,0,0,4
DC20798,KISSENA CHERRY DAYCARE,KISSENA CHERRY DAY CARE INC,140-26 CHERRY AVE.,QUEENS,11355,718-886-2889,8128,2016-04-13,Permitted,2 YEARS - 5 YEARS,99,No,Private,11,2,6,3,11
DC21856,KNUGENX LEARNING CENTER-PRESCHOOL,KNUGENX LEARNING CENTER,90 BOWERY,MANHATTAN,10013,212-966-1431,15617,2014-04-30,Expired-InRenewal,2 YEARS - 5 YEARS,27,No,Private,7,0,6,1,3
DC1157,KON WAH DAY SCHOOL,"KON WAH, INC.",135-27 38 AVENUE,QUEENS,11354,718-353-4388,6902,2015-05-18,Permitted,2 YEARS - 5 YEARS,274,No,Private,2,0,2,0,7
DC14141,KREATIVE KARE DAY CARE CENTER,"KREATIVE KARE DAYCARE CENTER, INC.",292 PALMETTO STREET,BROOKLYN,11237,718-386-3242,7649,2014-09-25,Permitted,2 YEARS - 5 YEARS,78,No,Private,13,2,6,5,9
DC18357,KREATIVE KARE TOO NURSERY SCHOOL,"KREATIVE KARE DAY CARE CENTER,INC.",541 KNICKERBOCKER AVENUE,BROOKLYN,11221,718-418-0088,7987,2015-01-15,Permitted,0 YEARS - 2 YEARS,18,No,Private,5,0,5,0,8
DC2022,L.P.B.C. DAY CARE,LEFFERTS PARK BAPTIST CHURCH,7524 14 AVENUE,BROOKLYN,11228,718-621-5458,7107,2015-03-05,Permitted,2 YEARS - 5 YEARS,19,No,Private,0,0,0,0,6
DC15136,LA CASITA  I I I  PRESCHOOL,"UNITED BRONX PARENTS, INC.",607 PROSPECT AVENUE,BRONX,10455,718-742-0083,7603,2014-06-10,Expired-InRenewal,2 YEARS - 5 YEARS,14,No,Private,17,1,10,6,9
DC10763,LA ESCUELITA,LA ESCUELITA INC.,302 WEST 91 STREET,MANHATTAN,10024,212-877-1100,7289,2014-10-10,Permitted,2 YEARS - 5 YEARS,52,No,Private,8,2,5,1,6
DC981,LA PENINSULA  COMMUNITY  ORGANIZATION  HEAD START PROGRAM 2,"LA PENINSULA COMMUNITY ORGANIZATION, INC.",1054 INTERVALE AVENUE,BRONX,10459,718-893-5074,4780,2015-06-08,Permitted,2 YEARS - 5 YEARS,110,No,ACS Contracted Preschools,5,2,1,2,7
DC817,LA PENINSULA  HEAD START,"LA PENINSULA COMMUNITY ORGANIZATION, INC.",711 MANIDA STREET,BRONX,10474,718-542-7590,3018,2015-01-19,Permitted,2 YEARS - 5 YEARS,137,Yes,ACS Contracted Preschools,9,1,2,6,7
DC188,LA PENINSULA HEAD START,"LA PENINSULA COMMUNITY ORGANIZATION, INC.",1717 FULTON AVENUE,BRONX,10457,718-215-2020,7253,2014-07-19,Permitted,2 YEARS - 5 YEARS,113,No,ACS Contracted Preschools,9,2,4,3,7
DC93,LA PENINSULA HEAD START,"LA PENINSULA COMMUNITY ORGANIZATION, INC.",1871 WALTON AVENUE,BRONX,10453,718-215-2220,6666,2014-07-25,Permitted,2 YEARS - 5 YEARS,147,No,ACS Contracted Preschools,3,1,1,1,5
DC336,LABOR  BATHGATE COMMUNITY CHILD CARE CENTER,"LABOR BATHGATE COMMUNITY CHILD CARE,INC.",1638 ANTHONY AVENUE,BRONX,10457,718-583-3850,4127,2015-06-17,Permitted,2 YEARS - 5 YEARS,68,Yes,ACS Contracted Preschools,24,9,8,7,7
DC25338,LAC EARLY CHILDHOOD CENTER,"LIFE ADJUSTMENT CENTER, INC.",325 EAST 101ST  STREET,MANHATTAN,10029,212-938-1221,58077,2016-03-06,Permitted,2 YEARS - 5 YEARS,45,Yes,Private,0,0,0,0,0
DC20108,LACONIA DAY CARE CENTER,"LACONIA DAY CARE CENTER & INFANT CARE,INC",3950 LACONIA AVENUE,BRONX,10466,718-547-0000,14817,2016-04-13,Permitted,2 YEARS - 5 YEARS,82,No,Private,32,5,17,10,8
DC21654,LACONIA DAY CARE CENTER,LACONIA DAY CARE CENTER & INFANT CARE INC.,3950 LACONIA AVENUE,BRONX,10466,718-547-0000,14837,2016-04-13,Permitted,0 YEARS - 2 YEARS,28,No,Private,42,6,21,15,8
DC14097,"LAGUARDIA COMMUNITY COLLEGE ECLC PROGRAMS,INC.","LAGUARDIA COMMUNITY COLLEGE ECLC PROGRAMS,INC",31-10 THOMSON AVENUE,QUEENS,11101,718-482-5295,4544,2014-06-19,Permitted,2 YEARS - 5 YEARS,30,No,Private,1,0,1,0,8
DC17886,LAGUARDIA COMMUNITY EARLY CHILDHOOD LEARNING CENTER PROGRAM,LAGUARDIA COMMUNITY COLLEGE EARLY CHILDHOOD LEARNING CENTER PROGRAM,31-10 THOMSON AVENUE,QUEENS,11101,718-482-5295,7826,2015-12-28,Permitted,2 YEARS - 5 YEARS,84,No,Private,7,1,6,0,10
DC25981,LAPUERTA ABIERTA EARLY LEARN CENTER,POLICE ATHLETIC LEAGUE INC.,3001 WEST 37TH STREET,BROOKLYN,11224,718-372-4044,51657,2015-09-06,Permitted,2 YEARS - 5 YEARS,61,No,Private,0,0,0,0,1
DC23155,LAUGH & LEARN PLACE,LAUGH & LEARN PLACE,228-01 MERRICK BLVD.,QUEENS,11413,718-525-5318,30717,2015-01-14,Permitted,2 YEARS - 5 YEARS,26,No,Private,4,1,3,0,4
DC2982,"LAURELTON DAY CARE, INC P/S",LAURELTON CHILD CARE INC,141-19 224 STREET,QUEENS,11413,718-712-1860,6624,2016-03-15,Permitted,2 YEARS - 5 YEARS,89,No,Private,12,4,7,1,11
DC12281,"LAURELTON DAY CARE, INC.",LAURELTON DAY CARE INC TODDLER PROGRAM,141-19 224 STREET,QUEENS,11413,718-712-1860,6625,2015-04-06,Permitted,0 YEARS - 2 YEARS,16,No,Private,11,3,7,1,9
DC2087,LAVELLE SCHOOL FOR THE BLIND,LAVELLE SCHOOL FOR THE BLIND,3830 PAULDING AVENUE,BRONX,10469,718-882-1212,7139,2015-06-26,Permitted,2 YEARS - 5 YEARS,94,No,Private,17,4,3,10,6
DC18398,LE PETIT PARADIS,LE PETIT PARADIS,1656 THIRD  AVENUE,MANHATTAN,10128,212-410-0180,7902,2014-08-01,Permitted,2 YEARS - 5 YEARS,30,No,Private,5,1,2,2,7
DC19001,LEAKEE AND WATTS HEAD START PROGRAM,"LEAKE AND WATTS SERVICES, INC.",2165 RANDALL AVENUE,BRONX,10473,718-904-1689,8147,2016-05-07,Permitted,2 YEARS - 5 YEARS,94,No,Head Start (Direct Fed. Funding),4,1,0,3,8
DC20647,"LEARNING LADDER CENTER,LLC","LEARNING LADDER CENTER, LLC",125-19 101 AVENUE,QUEENS,11419,718-480-6444,20497,2014-08-08,Permitted,2 YEARS - 5 YEARS,20,No,Private,1,0,1,0,4
DC21774,LEARNING LADDER DAY CARE CENTER,"ALL CARE PROVIDER SERVICES, INC.",100A ALDRICH STREET,BRONX,10475,718-618-0782,8310,2015-07-15,Permitted,2 YEARS - 5 YEARS,80,No,Private,10,2,4,4,6
DC21893,LEAVITT DAY CARE,"LEAVITT DAY CARE, INC.",34-51 LEAVITT STREET,QUEENS,11354,718-321-2717,8364,2015-07-07,Permitted,2 YEARS - 5 YEARS,41,No,Private,23,1,18,4,12
DC1675,LEFFERTS GARDENS MONTESSORI SCHOOL #1,MOM'S CENTER FOR EARLY CHILDHOOD DEVELOPMENT INC. #1,559 ROGERS AVENUE,BROOKLYN,11225,718-773-0287,4893,2014-07-13,Permitted,2 YEARS - 5 YEARS,26,No,Private,27,5,11,11,10
DC14250,LEFFERTS GARDENS MONTESSORI SCHOOL #2,"MOM'S CENTER FOR EARLY CHILDHOOD DEVELOPMENT,INC. #2",527 ROGERS AVENUE,BROOKLYN,11225,718-773-0287,5878,2014-07-13,Permitted,2 YEARS - 5 YEARS,75,No,Private,20,5,5,10,9
DC14357,LEGGETT MEMORIAL CHILD CARE CENTER,"UNION SETTLEMENT ASSOCIATION, INC.",237 EAST 104 STREET,MANHATTAN,10029,212-828-6051,1997,2015-11-02,Permitted,2 YEARS - 5 YEARS,90,Yes,ACS Contracted Preschools,26,2,13,11,9
DC2406,LEMON TREE LEARNING CENTER,"LEMON TREE OF RICHMOND,INC.",341 ELVIN STREET,STATEN ISLAND,10314,718-698-9103,5477,2014-09-29,Permitted,2 YEARS - 5 YEARS,58,No,Private,17,4,8,5,7
DC3059,LENOX HILL NEIGHBORHOOD HOUSE EARLY CHILDHOOD CENTER,LENOX HILL NEIGHBORHOOD HOUSE,331 EAST 70 STREET,MANHATTAN,10021,212-744-5022,2056,2016-05-08,Permitted,2 YEARS - 5 YEARS,144,No,ACS Head Start,28,6,14,8,6
DC2261,"LES ENFANTS MONTESSORI SCHOOL,INC.","LES ENFANTS MONTESSORI SCHOOL,INC.",29-21 NEWTOWN AVENUE,QUEENS,11102,718-626-9549,4715,2016-03-10,Permitted,2 YEARS - 5 YEARS,144,No,Private,7,2,4,1,6
DC1294,LEXINGTON CHILDREN'S CENTER,LEXINGTON CHILDREN'S CENTER,115 EAST 98 STREET,MANHATTAN,10029,212-410-1060,2156,2015-04-07,Permitted,2 YEARS - 5 YEARS,53,Yes,ACS Contracted Preschools,34,8,17,9,10
DC10735,LIBERTY DAY CARE SERVICE,"LIBERTY DAY CARE SERVICE,INC.",478 EAST 95 STREET,BROOKLYN,11212,718-498-4384,7093,2015-02-08,Permitted,2 YEARS - 5 YEARS,31,No,Private,23,5,9,9,14
DC22799,"LIBERTY DAY CARE SERVICE, INC.","LIBERTY DAY CARE SERVICE, INC.",478 EAST 95TH STREET,BROOKLYN,11212,718-498-4384,28517,2014-12-04,Permitted,0 YEARS - 2 YEARS,25,No,Private,0,0,0,0,7
DC3044,LIC YMCA EARLY CHILD CARE PROGRAM,YMCA OF GREATER NY,32-23 QUEENS BOULEVARD,QUEENS,11101,718-392-7932,7741,2015-04-08,Permitted,2 YEARS - 5 YEARS,53,No,Private,8,1,6,1,6
DC14239,LIFE SKILLS HOME TRAINING TUTORIAL PROGRAM FOR PRE-SCHOOLERS,"LIFE SKILLS HOME TRAINING TUTORIAL PROGRAM FOR PRE-SCHOOLERS, INC.",3051 EAST TREMONT AVENUE,BRONX,10461,718-828-8462,6088,2015-08-25,Permitted,2 YEARS - 5 YEARS,41,No,Private,6,1,1,4,5
DC1153,LIFELINE CENTER FOR CHILD DEVELOPMENT,LIFELINE CENTER FOR CHILD DEVELOPMENT,80-09 WINCHESTER BOULEVARD,QUEENS,11427,718-740-4300,5518,2015-04-25,Permitted,2 YEARS - 5 YEARS,71,No,Private,7,1,3,3,7
DC14770,LIGHT AND BRIGHT EARLY LEARNING CENTER,LIGHT AND BRIGHT EARLY LEARNING CENTER,1185 EAST 223 STREET,BRONX,10466,718-231-5031,7640,2014-09-20,Permitted,2 YEARS - 5 YEARS,28,No,Private,18,0,7,11,9
DC1449,LIGHTHOUSE INTERNATIONAL CHILD DEVELOPMENT CENTER,LIGHTHOUSE INTERNATIONAL,111 EAST 59 STREET,MANHATTAN,10022,212-821-9600,6122,2014-04-29,Expired-InRenewal,2 YEARS - 5 YEARS,97,No,Private,4,1,0,3,8
DC1128,LIGHTHOUSE PRESCHOOL,LIGHTHOUSE PRESCHOOL,80-82 BOWERY,MANHATTAN,10013,212-219-8813,7039,2014-09-27,Permitted,2 YEARS - 5 YEARS,40,No,Private,11,2,6,3,6
DC235,LIL INVENTORS,LITTLE SHEPHERDS COMMUNITY SERVIES INC,2260 ANDREWS AVENUE,BRONX,10468,718-295-2740,7510,2016-02-20,Permitted,2 YEARS - 5 YEARS,18,No,Private,10,1,2,7,7
DC20556,LIL' ANGELS CHILDCARE,"LIL' ANGELS CHILDCARE, INC.",520 ELLSWORTH AVENUE,BRONX,10465,718-792-2273,8151,2016-05-10,Permitted,2 YEARS - 5 YEARS,30,No,Private,32,5,16,11,8
DC14376,LIL' FOOTPRINTS,LIL' FOOT PRINTS LTD,7805 20 AVENUE,BROOKLYN,11214,718-234-5890,7587,2016-03-27,Permitted,2 YEARS - 5 YEARS,20,No,Private,19,1,12,6,6
DC1296,"LILLIAN WALD DAY CARE CENTER OF THE EDUCATIONAL ALLIANCE, INC.",THE EDUCATIONAL ALLIANCE,34 AVENUE D,MANHATTAN,10009,212-780-5225,4059,2015-07-02,Permitted,2 YEARS - 5 YEARS,76,No,ACS Contracted Preschools,20,6,10,4,6
DC21013,LION OF JUDAH CHRISTIAN ACADEMY,LION OF JUDAH CHRISTIAN ACADEMY L L C,2336 ANDREWS AVENUE,BRONX,10468,718-772-3238,8181,2014-09-10,Permitted,2 YEARS - 5 YEARS,30,No,Private,5,0,2,3,6
DC14309,"LIPTON CORP. CHILD CARE, INC.","BRIGHT HORIZONS CHILD CARE CENTER, INC.",410 PARK AVENUE,MANHATTAN,10022,212-354-5222,7559,2015-01-04,Permitted,0 YEARS - 2 YEARS,17,No,Corporate,0,0,0,0,6
DC22736,LITTLE  APPLE PRESCHOOL,LITTLE APPLE CORP,213-54 35 AVENUE,QUEENS,11361,347-581-9467,49057,2015-07-31,Permitted,2 YEARS - 5 YEARS,22,No,Private,2,0,2,0,1
DC1835,LITTLE  STARS  SCHOOL,"CHRISTINE DEGENNARO/LITTLE STARS SCHOOL, INC.",4063 EDSON AVENUE,BRONX,10466,718-994-0604,5414,2015-11-24,Permitted,2 YEARS - 5 YEARS,104,No,Private,9,2,6,1,6
DC77,LITTLE ANGEL  DAY CARE  CENTER #4,LITTLE ANGEL DAYCARE CENTER INC.,899 CLARKSON AVENUE,BROOKLYN,11203,718-774-2930,6626,2015-09-08,Permitted,2 YEARS - 5 YEARS,18,No,Private,35,5,21,9,8
DC12236,"LITTLE ANGEL DAY CARE #3, INC.","LITTLE ANGEL DAYCARE CENTER #3, INC.",12 CROWN STREET,BROOKLYN,11225,718-469-0229,7010,2015-01-09,Permitted,2 YEARS - 5 YEARS,56,No,Private,10,1,5,4,8
DC17699,LITTLE ANGEL DAY CARE CENTER #6,"LITTLE ANGEL DAY CARE CENTER VI, INC",272 TROY AVENUE,BROOKLYN,11213,718-774-7747,8054,2015-08-04,Permitted,2 YEARS - 5 YEARS,29,Yes,Private,14,2,6,6,7
DC22073,LITTLE ANGEL'S PLACE #1,LITTLE ANGELS PLACE 1 CORP.,159 ELLERY STREET,BROOKLYN,11206,718-576-6264,16577,2014-05-16,Expired-InRenewal,2 YEARS - 5 YEARS,27,No,Private,16,2,8,6,5
DC974,LITTLE ANGELS  HOLY SPIRIT HEAD START & UPK,LITTLE ANGELS HEAD START PROGRAM OF THE ARCHDIOCESE OF N.Y.,1960 UNIVERSITY AVENUE,BRONX,10453,718-731-8439,5078,2015-04-12,Permitted,2 YEARS - 5 YEARS,37,No,Head Start (Direct Fed. Funding),14,3,8,3,7
DC19408,LITTLE ANGELS DAY CARE,LITTLE ANGELS DAY CARE,1802 MATTHEWS AVE,BRONX,10462,917-708-9003,8329,2014-10-13,Permitted,2 YEARS - 5 YEARS,22,No,Private,21,5,8,8,6
DC25357,LITTLE ANGELS DAY CARE CENTER,"LITTLE ANGELS DAY CARE CENTER, INC.",906-908 PROSPECT AVENUE,BRONX,10459,347-963-9788,55320,2015-12-18,Permitted,2 YEARS - 5 YEARS,25,No,Private,3,1,0,2,1
DC22737,LITTLE APPLE PRESCHOOL,LITTLE APPLE CORP/INFANT TODDLER,213-54 35 AVENUE,QUEENS,11361,347-581-9467,49077,2015-07-31,Permitted,0 YEARS - 2 YEARS,12,No,Private,0,0,0,0,2
DC24545,LITTLE BELL CHILDCARE CORP.,LITTLE BELL CHILDCARE CORP.,629 51ST STREET,BROOKLYN,11220,718-686-8808,31639,2015-01-29,Permitted,2 YEARS - 5 YEARS,88,No,Private,12,2,2,8,3
DC21573,LITTLE BERRIES INC,LITTLE BERRIES INC.,8416 19 AVENUE,BROOKLYN,11214,929-333-9595,8322,2015-06-20,Permitted,2 YEARS - 5 YEARS,65,No,Private,89,22,48,19,19
DC17585,LITTLE BIRDS DAY CARE CENTER,"LITTLE BIRDS DAY CARE CENTER,LLC.",490 LINWOOD STREET,BROOKLYN,11208,718-647-8095,7926,2014-11-15,Permitted,2 YEARS - 5 YEARS,15,No,Private,19,4,6,9,11
DC19178,LITTLE BIRDS DAY CARE CENTER,"LITTLE BIRDS DAY CARE CENTER, LLC.",490 LINWOOD STREET,BROOKLYN,11208,718-647-8095,7953,2014-11-19,Permitted,0 YEARS - 2 YEARS,14,No,Private,14,2,9,3,9
DC23147,"LITTLE BRILLIANT MINDS, INC.","LITTLE BRILLIANT MINDS, INC.",5916  20TH AVENUE,BROOKLYN,11204,718-234-6463,51299,2015-08-29,Permitted,2 YEARS - 5 YEARS,28,No,Private,0,0,0,0,1
DC10702,LITTLE DREAMERS,N&B FRIENDSHIP INC.,4317 AVENUE D,BROOKLYN,11203,718-451-2566,7028,2014-06-04,Expired-InRenewal,2 YEARS - 5 YEARS,25,No,Private,11,4,6,1,9
DC19370,"LITTLE ELMS CHILD CARE CENTER,I/T","BRIGHT HORIZONS CHILDREN'S CENTER,INC",77-11 BROADWAY,QUEENS,11373,718-334-2264,8091,2013-12-18,Expired-InRenewal,0 YEARS - 2 YEARS,18,No,Corporate,6,1,2,3,9
DC20339,"LITTLE ELMS CHILD CARE CENTER,P/S","BRIGHT HORIZONS CHILDREN'S CENTER, INC",77-11 BROADWAY,QUEENS,11373,718-334-2264,8090,2015-12-18,Permitted,2 YEARS - 5 YEARS,15,No,Private,8,1,4,3,9
DC16871,LITTLE EXPLORERS PRESCHOOL & DAY CARE,"LITTLE EXPLORERS,INC.",213-41 40 AVENUE,QUEENS,11361,347-502-7073,7940,2014-10-25,Permitted,2 YEARS - 5 YEARS,15,No,Private,4,1,2,1,7
DC21525,LITTLE FLOWER DAY CARE,LITTLE FLOWER DAY CARE CORP.,251-16 HILLSIDE  AVENUE,QUEENS,11426,646-229-3380,59577,2016-03-24,Permitted,2 YEARS - 5 YEARS,20,No,Private,0,0,0,0,4
DC1354,LITTLE FLOWERS EARLY CHILDHOOD CENTER ANNEX,LITTLE FLOWERS EARLY CHILDHOOD CENTER INC.,234-14 MERRICK BOULEVARD,QUEENS,11422,718-712-1440,7082,2015-01-10,Permitted,2 YEARS - 5 YEARS,15,No,Private,4,1,3,0,7
DC2127,"LITTLE FLOWERS EARLY CHILDHOOD CENTER, INC","LITTLE FLOWERS EARLY CHILDHOOD CENTER, INC",234-10 MERRICK BOULEVARD,QUEENS,11422,718-712-1440,6195,2014-07-14,Permitted,2 YEARS - 5 YEARS,26,No,Private,4,1,2,1,8
DC25290,LITTLE FRIENDS ACADEMY,"FUNCTIONAL LIFE ACHIEVEMENT, INC",149-34 35 AVENUE,QUEENS,11354,718-886-6502,42372,2015-06-03,Permitted,2 YEARS - 5 YEARS,140,No,Private,2,0,0,2,2
DC25611,LITTLE FRIENDS GAN PRESCHOOL,LITTLE FRIENDS GAN LLC,1030 NEILSON STREET,QUEENS,11691,718-327-3287,53140,2015-10-17,Permitted,2 YEARS - 5 YEARS,49,No,Private,0,0,0,0,2
DC12375,LITTLE FRIENDS HOUSE 111,G.R.Z.S. CORP,12-45 150 STREET,QUEENS,11357,718-746-7505,6878,2015-03-18,Permitted,2 YEARS - 5 YEARS,22,No,Private,1,0,1,0,12
DC14178,LITTLE FRIENDS HOUSE II,L & R DAY CARE CENTER INC,75-41 164 STREET,QUEENS,11366,718-380-8800,5761,2014-10-27,Permitted,2 YEARS - 5 YEARS,34,No,Private,11,1,10,0,16
DC1115,LITTLE FRIENDS HOUSE II INF/TOD,L & R DAY CARE CENTER INC.,75-41 164 STREET,QUEENS,11366,718-380-8800,5762,2015-11-02,Permitted,0 YEARS - 2 YEARS,20,No,Private,9,4,4,1,14
DC2429,LITTLE FRIENDS HOUSE III,G.R.Z.S. CORP.,12-45 150 ST,QUEENS,11357,718-746-7505,6879,2015-03-11,Permitted,0 YEARS - 2 YEARS,10,No,Private,1,0,1,0,10
DC2298,LITTLE FRIENDS SCHOOL OF ELMHURST,LITTLE FRIENDS SCHOOL ELMHURST,85-03 BRITTON AVENUE,QUEENS,11373,718-458-5415,6759,2015-04-01,Permitted,2 YEARS - 5 YEARS,75,No,Private,5,3,0,2,8
DC2313,LITTLE FRIENDS SCHOOL/SUNNYSIDE INC.,LITTLE FRIENDS SCHOOL SUNNYSIDE INC.,43-42 47 STREET,QUEENS,11104,718-786-4644,4326,2015-11-19,Permitted,2 YEARS - 5 YEARS,101,No,Private,10,1,6,3,8
DC21038,LITTLE HANDS AND FEET DAY CARE DAY CARE,"LITTLE HANDS AND FEET DAYCARE, LLC.",1270 BAY RIDGE PARKWAY,BROOKLYN,11228,718-680-5437,8355,2015-11-02,Permitted,2 YEARS - 5 YEARS,31,No,Private,4,0,1,3,6
DC21769,LITTLE HANDS AND FEET DAY CARE LLC,LITTLE HANDS AND FEET DAY CARE LLC,1270 BAY RIDGE PARKWAY,BROOKLYN,11228,718-680-5437,8402,2015-10-24,Permitted,0 YEARS - 2 YEARS,25,No,Private,5,0,3,2,5
DC11063,LITTLE L.A.M.B. PRE-SCHOOL,"LITTLE L.A.M.B. PRE-SCHOOL, INC.",2 GRIDLEY AVENUE,STATEN ISLAND,10303,718-448-7774,6114,2014-05-27,Expired-InRenewal,2 YEARS - 5 YEARS,120,No,Private,8,0,0,8,4
DC2262,LITTLE MEADOWS EARLY CHILDHOOD CENTER,LITTLE MEADOWS EARLY CHILDHOOD CENTER,67-25 188 STREET,QUEENS,11365,718-454-6460,7200,2016-01-22,Permitted,2 YEARS - 5 YEARS,105,Yes,Private,5,0,4,1,8
DC15215,LITTLE MIRACLES PRESCHOOL,"EDEN II SCHOOL FOR AUTISTIC CHILDREN, INC.",75 SKYLINE DRIVE,STATEN ISLAND,10304,718-727-8202,7702,2015-01-04,Permitted,2 YEARS - 5 YEARS,31,No,Private,18,4,7,7,8
DC2640,LITTLE MISSIONARY'S DAY NURSERY,LITTLE MISSIONARY'S DAY NURSERY,93 ST MARK'S PLACE,MANHATTAN,10009,212-777-9774,4571,2015-01-17,Permitted,2 YEARS - 5 YEARS,39,No,Private,15,4,6,5,7
DC24638,LITTLE MUNCHKINS 42,LITTLE MUNCHKINS 42 INC.,1411 41ST STREET,BROOKLYN,11218,718-853-3160,38297,2015-04-25,Permitted,2 YEARS - 5 YEARS,21,No,Private,12,1,6,5,3
DC22712,LITTLE MUNCHKINS 47,LITTLE MUNCHKINS 47 INC.,4712 12TH AVENUE,BROOKLYN,11219,718-437-7261,21739,2014-08-29,Permitted,2 YEARS - 5 YEARS,30,No,Private,13,0,9,4,4
DC25653,LITTLE MUNCHKINS 56,"LITTLE MUNCHKINS 56, INC.",1460 56TH STREET,BROOKLYN,11219,718-437-7261,55817,2016-01-07,Permitted,0 YEARS - 2 YEARS,29,No,Private,3,1,2,0,1
DC25695,LITTLE NEST COMMUNITY NURSERY,"LITTLE NEST COMMUNITY NURSERY, LLC",511 CHURCH AVENUE,BROOKLYN,11218,718-484-0033,55258,2015-12-17,Permitted,2 YEARS - 5 YEARS,28,No,Private,0,0,0,0,0
DC11386,LITTLE ONES - PRESCHOOL,LITTLE ONES - PRESCHOOL,4-74 48 AVENUE,QUEENS,11109,718-392-1254,7424,2015-09-15,Permitted,2 YEARS - 5 YEARS,45,No,Private,6,1,1,4,8
DC23017,"LITTLE ONES, LLC","LITTLE ONES, LLC",50-13 5 STREET,QUEENS,11101,718-392-4140,56577,2016-02-04,Permitted,2 YEARS - 5 YEARS,24,No,Private,1,1,0,0,1
DC922,LITTLE PARADISE INC,LITTLE PARADISE INC,4714 CLARENDON ROAD,BROOKLYN,11203,718-629-3230,6736,2016-03-22,Permitted,2 YEARS - 5 YEARS,27,No,Private,30,6,15,9,8
DC1796,LITTLE PEOPLE'S ACADEMY,JANET LAWRENCE,3217 CHURCH AVENUE,BROOKLYN,11226,718-287-6200,6382,2015-06-27,Permitted,2 YEARS - 5 YEARS,23,No,Private,12,1,7,4,6
DC2045,LITTLE PEOPLES DAY CARE,LITTLE PEOPLES DAY CARE INC.,1600 SEDGWICK AVENUE,BRONX,10453,718-731-7575,5644,2014-11-10,Permitted,2 YEARS - 5 YEARS,38,No,Private,22,2,15,5,5
DC22109,LITTLE PICKLES,ERL GROUP LLC,2169 CONEY ISLAND AVENUE,BROOKLYN,11223,718-676-1725,32577,2015-02-14,Permitted,0 YEARS - 2 YEARS,15,No,Private,4,1,3,0,5
DC22180,LITTLE PRINCETON NURSERY AND  DAY CARE CENTER LLC (PRESCHOOL),LITTLE PRINCETON NURSERY AND DAY CARE CENTER LLC,10023 SEAVIEW   AVENUE,BROOKLYN,11236,718-513-4416,12617,2016-02-21,Permitted,2 YEARS - 5 YEARS,18,No,Private,12,2,5,5,7
DC19468,LITTLE PRINCETON NURSERY AND DAY CARE CENTER LLC ( I/T ),LITTLE PRINCETON NURSERY AND DAY CARE CENTER LLC,10023 SEAVIEW   AVENUE,BROOKLYN,11236,718-513-4416,12558,2016-02-17,Permitted,0 YEARS - 2 YEARS,18,No,Private,22,5,11,6,8
DC20961,LITTLE PRODIGIES DAYCARE INC.,LITTLE PRODIGIES DAYCARE INC.,3462  EAST TREMONT AVENUE,BRONX,10465,718-239-4853,13038,2016-02-29,Permitted,2 YEARS - 5 YEARS,53,No,Private,14,3,5,6,5
DC12228,LITTLE RED RIDING HOOD  (I/T),LITTLE RED RIDING HOOD CORP. (I/T),237 LEFFERTS AVENUE,BROOKLYN,11225,718-953-0900,7241,2016-01-30,Permitted,0 YEARS - 2 YEARS,24,No,Private,43,8,18,17,13
DC1010,LITTLE RED RIDING HOOD CORP.  PRESCHOOL,LITTLE RED RIDING HOOD CORP.,237 LEFFERTS AVENUE,BROOKLYN,11225,718-953-0900,7240,2016-01-30,Permitted,2 YEARS - 5 YEARS,51,No,Private,55,6,23,26,11
DC1167,LITTLE RED WAGON,"LITTLE RED WAGON, INC.",188-06 JAMAICA AVENUE,QUEENS,11423,718-468-6627,6956,2016-02-01,Permitted,2 YEARS - 5 YEARS,20,No,Private,17,3,9,5,10
DC25984,LITTLE SCHOLARS DAY CARE CENTER,LITTLE SCHOLARS DAY CARE CENTER INC.,5721 6TH  AVENUE,BROOKLYN,11220,718-633-8828,56037,2016-01-17,Permitted,2 YEARS - 5 YEARS,86,No,Private,0,0,0,0,1
DC21141,LITTLE SCHOLARS EARLY DEVELOPMENT CENTER,"LITTLE SCHOLARS EARLY DEVELOMENT CENTER, L L C",850 JENNINGS STREET,BRONX,10459,718-887-2928,8305,2015-06-17,Permitted,2 YEARS - 5 YEARS,53,No,Private,9,1,5,3,5
DC25556,LITTLE SCHOLARS LEARNING CENTER,"M AND N CHILD CARE, INC.",50 QUENTIN ROAD,BROOKLYN,11223,718-373-7046,49897,2015-08-09,Permitted,0 YEARS - 2 YEARS,15,No,Private,7,2,4,1,1
DC25557,LITTLE SCHOLARS LEARNING CENTER,"M AND N CHILD CARE, INC.",52 QUENTIN ROAD,BROOKLYN,11223,718-373-7046,49917,2015-08-09,Permitted,2 YEARS - 5 YEARS,26,No,Private,6,2,2,2,1
DC17965,LITTLE SCHOLARS ON FARMERS,HAPPY PARENTS HAPPY KIDS INC.,117-25 FARMERS BLVD,QUEENS,11412,718-949-2390,8337,2014-10-15,Permitted,2 YEARS - 5 YEARS,30,No,Private,20,1,11,8,9
DC3028,LITTLE STAR OF BROOME STREET DAY CARE CENTER,"CHINESE-AMERICAN PLANNING COUNCIL, INC.",151 BROOME STREET,MANHATTAN,10002,212-673-2680,4223,2015-05-26,Permitted,2 YEARS - 5 YEARS,75,Yes,ACS Contracted Preschools,22,5,9,8,10
DC21405,LITTLE STAR PRESCHOOL,CONGREGATION OORAH,374  RIDGEWOOD AVENUE,STATEN ISLAND,10312,718-948-7827,8220,2014-10-07,Permitted,2 YEARS - 5 YEARS,48,No,Private,23,5,12,6,9
DC16772,LITTLE STARS,'ABC' LITTLE STAR DAY CARE INC.,2345     85TH STREET,BROOKLYN,11214,718-265-0156,7729,2015-03-09,Permitted,0 YEARS - 2 YEARS,18,No,Private,28,7,15,6,9
DC11675,LITTLE STARS,'ABC' LITTLE STAR DC INC.,2345 85 STREET,BROOKLYN,11214,718-265-0156,7730,2015-03-09,Permitted,2 YEARS - 5 YEARS,23,No,Private,20,7,5,8,9
DC1711,LITTLE STARS DAY CARE CENTER INC.,LITTLE STARS DAY CARE CENTER INC.,588 BROOKLYN AVENUE,BROOKLYN,11203,718-467-5800,5299,2016-02-16,Permitted,2 YEARS - 5 YEARS,60,No,Private,20,6,6,8,6
DC22683,"LITTLE STARS THREE, INC.","LITTLE STARS THREE, INC.",1420 BURKE AVENUE,BRONX,10469,347-947-3171,18228,2016-06-22,Permitted,2 YEARS - 5 YEARS,64,No,Private,12,2,5,5,3
DC1977,LITTLE STARS TOO,"LITTLE STARS TOO, INC.",1083 ALLERTON AVENUE,BRONX,10469,718-515-8800,7037,2014-09-03,Permitted,2 YEARS - 5 YEARS,69,No,Private,16,2,9,5,7
DC950,"LITTLE SUN PEOPLE, INC.",LITTLE SUN PEOPLE INC.,1360 FULTON STREET,BROOKLYN,11216,718-789-7330,5955,2015-01-18,Permitted,2 YEARS - 5 YEARS,56,No,Private,33,2,19,12,11
