Site_ID,Center_Name,Permit_Holder,Address,Borough,Zip_Code,Phone,Permit_Number,Permit_Expiration_Date,Permit_Status,Age_Range,Maximum_Capacity,Certified_to_Administer_Medication,Site_Type,Number_Of_Violations,Hazard_Violations,Critical_Violations,General_Violations,Number_Of_Visits
DC1025,"CNC CARE CENTER, INC.",CNC CARE CENTER INC.,647 ROGERS AVENUE,BROOKLYN,11226,718-284-0172,6699,2015-09-14,Permitted,2 YEARS - 5 YEARS,17,No,Private,12,3,5,4,8
DC1609,CO-OP CITY N A A C P DAY CARE CENTER,CO-OP CITY N A A C P DAY CARE CENTER,100 ERSKINE PLACE,BRONX,10475,718-671-8519,2315,2015-03-05,Permitted,2 YEARS - 5 YEARS,43,No,Private,12,2,3,7,8
DC14649,"COBBLE HILL PLAYSCHOOL, INC.","COBBLE HILL PLAYSCHOOL, INC.",653 HICKS STREET,BROOKLYN,11231,718-243-0440,7547,2016-02-03,Permitted,2 YEARS - 5 YEARS,45,No,Private,2,0,2,0,5
DC11256,COLIN NEWELL EARLY CHILDHOOD DEVELOPMENT CENTER(HEAD START),"CATHOLIC CHARITIES NEIGHBORHOOD SERVICES, INC",161-06 89 AVENUE,QUEENS,11432,718-523-1888,7392,2015-05-23,Permitted,2 YEARS - 5 YEARS,112,No,ACS Head Start,14,3,8,3,10
DC2266,COLONIAL CHURCH NURSERY SCHOOL,COLONIAL CHURCH OF BAYSIDE,54-02 217 STREET,QUEENS,11364,718-224-3899,2299,2016-05-12,Permitted,2 YEARS - 5 YEARS,29,No,Private,1,1,0,0,7
DC1849,"COLONY-SOUTH BROOKLYN HOUSES, INC.","COLONY-SOUTH BROOKLYN HOUSES, INC.",222 GRAHAM AVENUE,BROOKLYN,11206,718-387-9482,4207,2015-01-14,Permitted,2 YEARS - 5 YEARS,60,No,Private,10,2,1,7,5
DC2579,COLUMBIA GREENHOUSE NURSERY SCHOOL,COLUMBIA GREENHOUSE NURSERY SCHOOL,404 WEST 116 STREET,MANHATTAN,10027,212-666-4796,2049,2015-12-16,Permitted,2 YEARS - 5 YEARS,50,Yes,Private,4,0,2,2,8
DC2638,COLUMBIA GREENHOUSE NURSERY SCHOOL,COLUMBIA GREENHOUSE NURSERY SCHOOL,424 WEST 116 STREET,MANHATTAN,10027,212-666-4796,1484,2015-12-16,Permitted,2 YEARS - 5 YEARS,30,No,Private,3,0,3,0,7
DC23074,COLUMBIA UNIVERSITY HEADSTART,"THE TRUSTEES OF COLUMBIA UNIVERSITY IN THE CITY OF NEW YORK, INC.",4467 BROADWAY,MANHATTAN,10040,212-923-5237,40717,2015-05-20,Permitted,2 YEARS - 5 YEARS,50,No,Private,2,1,0,1,2
DC2631,COLUMBUS PRE-SCHOOL,"COLUMBUS TOWNHOUSE NURSERY, INC.",606 COLUMBUS AVENUE,MANHATTAN,10024,212-721-0090,6360,2015-06-13,Permitted,2 YEARS - 5 YEARS,80,No,Private,10,1,6,3,4
DC25673,COMMITTEE FOR EARLY CHILDHOOD DEVELOPMENT,"COMMITTEE FOR EARLY CHILDHOOD DEVELOPMENT DAY CARE CENTER, INC.",193-25 JAMAICA AVENUE,QUEENS,11423,718-264-6572,52558,2015-09-27,Permitted,2 YEARS - 5 YEARS,90,Yes,Private,0,0,0,0,1
DC17250,COMMITTEE FOR EARLY CHILDHOOD DEVELOPMENT HEAD START,"COMMITTEE FOR EARLY CHILDHOOD DEVELOPMENT D.C.C.,INC.",117-21 SUTPHIN BOULEVARD,QUEENS,11436,718-848-0276,8199,2014-09-15,Permitted,2 YEARS - 5 YEARS,246,Yes,ACS Head Start,1,0,1,0,7
DC2131,COMMITTEE FOR EARLY CHILDHOOD DEVELOPMENT HEAD START,"COMMITTEE FOR EARLY CHILDHOOD DEVELOPMENT DAY CARE CENTER, INCORPORATED",193-04 JAMAICA AVENUE,QUEENS,11423,718-464-2422,4984,2015-03-30,Permitted,2 YEARS - 5 YEARS,146,Yes,ACS Head Start,13,1,12,0,10
DC11253,COMMUNITY & FAMILY HEAD START,COMMUNITY PARENTS INC.,41-05 BEACH CHANNEL DRIVE,QUEENS,11691,718-471-7970,7639,2014-09-08,Permitted,2 YEARS - 5 YEARS,113,No,ACS Head Start,2,1,1,0,7
DC1119,COMMUNITY CHURCH OF DOUGLASTON NURSERY SCH,LINDEN DE BIE C.C.D.,39-50 DOUGLASTON PARKWAY,QUEENS,11363,718-767-1961,0983,2014-04-26,Expired-InRenewal,2 YEARS - 5 YEARS,20,No,Private,9,1,5,3,8
DC2339,COMMUNITY HOUSE NURSERY AND KINDERGARTEN,CHURCH IN THE GARDENS COMMUNITY HOUSE,15 BORAGE PLACE,QUEENS,11375,718-268-0490,1546,2016-06-25,Permitted,2 YEARS - 5 YEARS,42,No,Private,0,0,0,0,8
DC2713,COMMUNITY LIFE CENTER  INC. ARTHUR EUGENE & THELMA  ADAIR  HEAD START,COMMUNITY LIFE CENTER INC.,221 EAST 122 STREET,MANHATTAN,10035,212-427-6800,7182,2016-01-25,Permitted,2 YEARS - 5 YEARS,159,No,ACS Head Start,20,1,13,6,12
DC2132,COMMUNITY LIFE CENTER MT. MORRIS HEAD START,"COMMUNITY LIFE CENTER,INC. ARTHUR EUGENE & THELMA ADAIR HEAD START",15 MOUNT MORRIS PARK WEST,MANHATTAN,10027,212-427-1077,8049,2015-09-23,Permitted,2 YEARS - 5 YEARS,135,No,ACS Head Start,6,2,3,1,8
DC1161,COMMUNITY NURSERY SCHOOL AT THE CHURCH ON THE HILL,THE CHURCH ON THE HILL - REFORMED,167-07 35 AVENUE,QUEENS,11358,718-539-0732,2323,2015-06-30,Permitted,2 YEARS - 5 YEARS,44,No,Private,7,2,4,1,6
DC2039,COMMUNITY PARENTS HEAD START,"COMMUNITY PARENTS, INC.",90 CHAUNCEY STREET,BROOKLYN,11233,718-771-4002,4639,2015-07-01,Permitted,2 YEARS - 5 YEARS,60,Yes,ACS Head Start,20,4,11,5,10
DC2142,COMMUNITY RESOURCES PRE-SCHOOL,"STATEN ISLAND AID FOR THE MENTALLY RETARDED, INC.",3651 RICHMOND ROAD,STATEN ISLAND,10306,718-351-6416,6674,2015-05-16,Permitted,2 YEARS - 5 YEARS,81,Yes,Private,9,1,3,5,4
DC21852,COMPREHENSIVE,COMPREHENSIVE KIDS DEVELOPMENT CENTER,101 NORFOLK STREET,MANHATTAN,10002,917-414-2344,17017,2014-05-22,Expired-InRenewal,2 YEARS - 5 YEARS,57,No,Private,5,0,4,1,2
DC17355,COMPREHENSIVE KIDS DEVELOPMENTAL SCHOOL,COMPREHENSIVE KIDS DEVELOPMENTAL SCHOOL,383-387 GRAND STREET,MANHATTAN,10002,212-539-0259,7872,2016-03-17,Permitted,2 YEARS - 5 YEARS,100,No,Private,18,7,5,6,6
DC22339,CONCERNED PARENTS OF JAMAICA EARLY LEARNING CENTER,"CLIFFORD GLOVER DAY CARE CENTER, INC.",143-04 101 AVENUE,QUEENS,11435,718-658-4091,25257,2014-10-16,Permitted,2 YEARS - 5 YEARS,129,No,ACS Contracted Preschools,10,0,2,8,5
DC11901,CONCOURSE HOUSE DAY CARE CENTER,CONCOURSE HOUSE,2751 GRAND CONCOURSE,BRONX,10468,718-584-4400,6239,2015-09-05,Permitted,2 YEARS - 5 YEARS,38,No,ACS Contracted Preschools,10,1,4,5,5
DC24619,CONEY ISLAND CHILD CARE CENTER,"LABOR & INDUSTRY FOR EDUCATION, INC.",2757 WEST 33RD STREET,BROOKLYN,11224,718-942-4494,24617,2014-10-11,Permitted,2 YEARS - 5 YEARS,58,No,ACS Contracted Preschools,34,9,18,7,8
DC22496,CONEY ISLAND DAY CARE,"CONEY ISLAND DAY CARE, INC",1001 NEWKIRK AVENUE,BROOKLYN,11230,347-915-0831,19317,2014-07-23,Permitted,2 YEARS - 5 YEARS,99,No,Private,24,4,12,8,5
DC17815,CONGREGATION B'NAI ISRAEL ACADEMY PRESCHOOL,CONGREGATION B'NAI ISRAEL OF STATEN ISLAND,45 TWOMBLY AVENUE,STATEN ISLAND,10306,718-987-6200,7852,2016-02-04,Permitted,2 YEARS - 5 YEARS,26,No,Private,3,0,2,1,6
DC426,CONGREGATION BETH ELOHIM  ECC,CONGREGATION BETH ELOHIM ECC,274 GARFIELD PLACE,BROOKLYN,11215,718-499-6208,4892,2014-09-22,Permitted,2 YEARS - 5 YEARS,200,No,Private,1,0,0,1,7
DC23180,CONGREGATION BNEI YONASAN,CONGREGATION BNEI YONASAN,1362 46TH STREET,BROOKLYN,11219,718-438-1825,50317,2015-08-15,Permitted,2 YEARS - 5 YEARS,30,No,Private,3,0,1,2,2
DC2279,"CONGREGATION OF THE MOTHERS OF THE HELPLESS, INC","CONGREGATION OF THE MOTHERS OF THE HELPLESS, INC",432 WEST 20 STREET,MANHATTAN,10011,212-929-0839,6880,2015-09-18,Permitted,0 YEARS - 2 YEARS,8,No,Private,6,2,2,2,6
DC14245,"CONGREGATION OF THE MOTHERS OF THE HELPLESS, INC.","CONGREGATION OF THE MOTHERS OF THE HELPLESS, INC.",432 WEST 20TH STREET,MANHATTAN,10011,212-929-0839,1382,2015-03-08,Permitted,2 YEARS - 5 YEARS,57,No,Private,13,2,11,0,8
DC1350,CONGREGATION OHEL YITZCHOK,CONGREGATION OHEL YITZCHOK,137-56 70 AVENUE,QUEENS,11367,718-261-7037,5218,2016-04-28,Permitted,2 YEARS - 5 YEARS,70,No,Private,14,3,6,5,7
DC12106,COOPER PARK CHILD CARE CENTER,"EPISCOPAL SOCIAL SERVICES OF NEW YORK, INC.",292 FROST STREET,BROOKLYN,11222,718-389-5959,5281,2015-02-12,Permitted,2 YEARS - 5 YEARS,55,No,ACS Contracted Preschools,30,2,7,21,7
DC1638,CORNERSTONE DAY CARE CENTER,"CORNERSTONE DAY CARE CENTER, INC.",289 LEWIS AVENUE,BROOKLYN,11221,718-574-8300,2267,2014-07-08,Permitted,2 YEARS - 5 YEARS,68,No,ACS Contracted Preschools,17,3,11,3,10
DC15603,"CORTELYOU  EARLY CHILDHOOD CENTER, INC.","CORTELYOU EARLY CHILDHOOD CENTER, INC.",2739  BEDFORD AVENUE,BROOKLYN,11210,718-421-9581,7676,2014-12-04,Permitted,2 YEARS - 5 YEARS,36,No,Private,15,2,6,7,7
DC1992,CORTELYOU EARLY CHILDHOOD CENTER INC.,"CORTELYOU EARLY CHILDHOOD CENTER, INC.",386 MARLBOROUGH ROAD,BROOKLYN,11226,718-856-2880,6644,2015-04-19,Permitted,2 YEARS - 5 YEARS,70,No,Private,16,2,8,6,5
DC1706,"CORTELYOU EARLY CHILDHOOD CENTER, INC.","CORTELYOU EARLY CHILDHOOD CENTER, INC.",1110 CORTELYOU ROAD,BROOKLYN,11218,718-282-6077,5481,2016-03-02,Permitted,2 YEARS - 5 YEARS,66,No,Private,16,2,7,7,8
DC22117,COSMOKIDZ  INFANTS,COSMOKIDZ  LLC,71-33 162 STREET,QUEENS,11365,718-380-5439,26497,2014-10-25,Permitted,0 YEARS - 2 YEARS,10,No,Private,3,1,2,0,4
DC22116,COSMOKIDZ PRE-SCHOOL,COSMOKIDZ LLC,71-33 162 STREET,QUEENS,11365,718-380-5439,26457,2014-10-25,Permitted,2 YEARS - 5 YEARS,38,No,Private,3,1,2,0,4
DC11633,COZY CRIB DAY CARE/PRESCHOOL,COZY CRIB INC.,6808 11 AVENUE,BROOKLYN,11219,718-833-3750,7201,2016-01-27,Permitted,2 YEARS - 5 YEARS,20,No,Private,16,0,8,8,9
DC14345,CPC JACOB RIIS CHILD CARE CENTER,"CHINESE AMERICAN PLANNING COUNCIL, INC",108 AVENUE D,MANHATTAN,10009,212-533-9138,6408,2016-01-09,Permitted,2 YEARS - 5 YEARS,35,Yes,ACS Contracted Preschools,8,2,2,4,6
DC2206,CPC JACOB RIIS CHILD CARE CENTER,"CHINESE AMERICAN PLANNING COUNCIL, INC.",90 AVENUE D,MANHATTAN,10009,212-533-9138,6419,2015-07-05,Permitted,0 YEARS - 2 YEARS,9,Yes,ACS Contracted Preschools,7,3,3,1,5
DC14177,CRAVATH CHILDREN'S CENTER  I/T,"CRAVATH, SWAINE & MOORE LLP",825 8 AVENUE,MANHATTAN,10019,212-474-4445,7121,2015-07-11,Permitted,0 YEARS - 2 YEARS,8,No,Private,1,0,0,1,5
DC3149,CRAVATH CHILDREN'S CENTER PRESCHOOL,"CRAVATH, SWAINE & MOORE LLP",825 8 AVENUE,MANHATTAN,10019,212-474-4445,7120,2015-07-11,Permitted,2 YEARS - 5 YEARS,20,No,Private,0,0,0,0,5
DC2929,CRAYON BOX PRESCHOOL,"CRAYON BOX, INC.",44-10 192 STREET,QUEENS,11358,718-888-9341,6680,2015-06-20,Permitted,2 YEARS - 5 YEARS,52,No,Private,8,1,7,0,8
DC22333,CREATIVE,CHILDREN'S CREATIVE LEARNING CENTERS,4  NEW YORK PLAZA,MANHATTAN,10004,212-513-7367,21878,2014-08-31,Permitted,2 YEARS - 5 YEARS,45,Yes,Private,2,0,2,0,3
DC22296,CREATIVE ACADEMY,CREATIVE ACADEMY OF NY LLC,228 BUSHWICK AVENUE,BROOKLYN,11206,347-689-2222,18897,2014-07-12,Permitted,2 YEARS - 5 YEARS,63,No,Private,27,9,12,6,7
DC22434,CREATIVE ACADEMY OF NY INFANT/TODDLER,CREATIVE ACADAMY OF NY LLC,228 BUSHWICK AVENUE,BROOKLYN,11206,347-689-2222,20777,2014-08-14,Permitted,0 YEARS - 2 YEARS,36,No,Private,16,5,7,4,7
DC10993,CREATIVE DISCOVERY PRE-SCHOOL,CREATIVE DISCOVERY PRE-SCHOOL INC,64-01 102 STREET,QUEENS,11374,718-897-5148,7293,2014-10-01,Permitted,2 YEARS - 5 YEARS,64,No,Private,7,3,3,1,8
DC25657,CREATIVE KIDS ACADEMY DAY CARE,BERTRAM THOMAS,917 EAST 82ND STREET,BROOKLYN,11236,347-608-0856,51960,2015-09-13,Permitted,2 YEARS - 5 YEARS,24,No,Private,1,0,0,1,2
DC25313,CREATIVE LEARNING CLUB HOUSE,"CREATIVE LEARNING CLUBHOUSE, INC.",275 WALKER STREET,STATEN ISLAND,10303,718-448-0582,64678,2016-05-20,Permitted,2 YEARS - 5 YEARS,30,No,Private,0,0,0,0,0
DC412,"CREATIVE MINDS CENTER,INC.","CREATIVE MINDS CENTER,INC.",1032 RUTLAND ROAD,BROOKLYN,11212,718-604-8486,5973,2014-11-15,Permitted,2 YEARS - 5 YEARS,35,No,Private,31,6,19,6,8
DC22243,CREATIVE MINDS PRESCHOOL,CREATIVE MINDS SERVICE L.L.C.,755 EASTERN PARKWAY,BROOKLYN,11213,718-576-6484,36798,2015-04-09,Permitted,2 YEARS - 5 YEARS,30,No,Private,44,9,26,9,5
DC26238,CREATIVE STEPS EARLY CARE AND EDUCATION,UNIVERSITY SETTLEMENT SOCIETY OF NEW YORK,4 WASHINGTON SQUARE VILLAGE,MANHATTAN,10012,212-982-2273,56100,2016-01-17,Permitted,0 YEARS - 2 YEARS,15,No,Private,0,0,0,0,0
DC26239,CREATIVE STEPS EARLY CARE AND EDUCATION,UNIVERSITY SETTLEMENT SOCIETY OF NEW YORK,4 WASHINGTON SQUARE VILLAGE,MANHATTAN,10012,212-982-2273,56101,2016-01-17,Permitted,2 YEARS - 5 YEARS,40,No,Private,0,0,0,0,0
DC12283,CREATIVE YEARS DAY CARE CENTER,CREATIVE YEARS DAY CARE CENTER,138-72 FRANCIS LEWIS BOULEVARD,QUEENS,11422,718-341-6288,7368,2015-03-18,Permitted,2 YEARS - 5 YEARS,20,No,Private,6,0,6,0,11
DC2268,CROSS ISLAND YMCA,"YOUNG MEN'S CHRISTIAN ASSOCIATION OF GREATER NEW YORK, INC.",238-10 HILLSIDE AVENUE,QUEENS,11427,718-551-9313,3029,2016-05-10,Permitted,2 YEARS - 5 YEARS,74,No,Private,33,9,11,13,13
DC25273,CYPRESS BRONX KATHY'S DAYCARE,CYPRESS BRONX KATHY'S DAYCARE INC.,235 CYPRESS AVENUE,BRONX,10454,718-585-2849,59718,2016-03-31,Permitted,2 YEARS - 5 YEARS,64,No,Private,0,0,0,0,0
DC10551,CYPRESS HILLS CHILD CARE CENTER,CYPRESS HILLS CHILD CARE CENTER CORPORATION,108 PINE STREET,BROOKLYN,11208,718-647-5005,6916,2015-08-17,Permitted,2 YEARS - 5 YEARS,74,No,ACS Contracted Preschools,15,2,9,4,8
DC23076,D'LITTLE STAR EDUCATION & ACTIVITY CENTER,D'LITTLE STAR DAY CARE INC.,111-08  SUTPHIN BLVD.,QUEENS,11435,718-297-9779,37037,2015-04-11,Permitted,2 YEARS - 5 YEARS,29,No,Private,3,1,2,0,4
DC716,DANIELLE 'S EDUCATING FOR THE FUTURE,"DANIELLE'S EDUCATING FOR THE FUTURE, INC.",144 EAST 56TH  STREET,BROOKLYN,11203,718-345-8778,6085,2015-08-28,Permitted,2 YEARS - 5 YEARS,28,No,Private,18,2,13,3,8
DC21686,DAWNING  VILLAGE TOO,"DAWNING VILLAGE, INC.",2211 FIRST AVENUE,MANHATTAN,10029,212-534-3999,8308,2013-06-20,Expired-InRenewal,2 YEARS - 5 YEARS,35,No,ACS Contracted Preschools,8,0,7,1,3
DC1291,"DAWNING VILLAGE, INC.","DAWNING VILLAGE, INC.",2090 1 AVENUE,MANHATTAN,10029,212-369-5313,6465,2015-06-04,Permitted,2 YEARS - 5 YEARS,105,No,ACS Contracted Preschools,33,7,13,13,17
DC21175,DAY SCHOOL AT CHRIST & SAINT STEPHEN'S CHURCH,CHRIST AND SAINT STEPHEN'S CHURCH,122 WEST 69TH STREET,MANHATTAN,10023,212-787-2755,10258,2015-12-23,Permitted,2 YEARS - 5 YEARS,58,No,Private,9,1,6,2,6
DC2341,DAYTON TOWERS WEST PLAYGROUP,DAYTON TOWERS WEST PLAYGROUP,105-00 SHORE FRONT PARKWAY,QUEENS,11694,718-474-8274,5302,2014-09-08,Permitted,2 YEARS - 5 YEARS,20,No,Private,6,2,4,0,9
DC21354,DCAIB CENTER,DCAIB CENTER LTD.,140-17 243 STREET,QUEENS,11422,718-528-3000,21637,2014-08-28,Permitted,2 YEARS - 5 YEARS,18,No,Private,2,1,1,0,4
DC1240,DEWITT REFORMED CHURCH HEAD START,DEWITT REFORMED CHURCH,123 RIDGE STREET,MANHATTAN,10002,212-505-8050,4941,2014-10-05,Permitted,2 YEARS - 5 YEARS,54,Yes,ACS Head Start,12,2,7,3,7
DC1241,DEWITT REFORMED CHURCH HEAD START,DEWITT REFORMED CHURCH,280 RIVINGTON STREET,MANHATTAN,10002,212-254-3070,2090,2014-10-05,Permitted,2 YEARS - 5 YEARS,95,Yes,ACS Head Start,31,6,14,11,9
DC19351,DIKI DAY CARE,DIKI DAYCARE,30-81 STEINWAY STREET,QUEENS,11103,718-278-1570,8084,2015-10-25,Permitted,2 YEARS - 5 YEARS,37,No,Private,30,8,16,6,14
DC24729,DIKI DISCOVERY CENTER,"DIKI DISCOVERY CENTER, INC.",30-16 37TH STREET,QUEENS,11103,718-000-0000,54237,2015-11-18,Permitted,0 YEARS - 2 YEARS,9,No,Private,3,0,3,0,2
DC26085,DIKI DISCOVERY CENTER,DIKI DISCOVERY CENTER,30-16 37TH STREET,QUEENS,11103,718-278-7500,54238,2015-11-18,Permitted,2 YEARS - 5 YEARS,19,No,Private,0,0,0,0,0
DC2605,DOLLY & FRANK RUSSO SR. FIRST STEP EARLY CHILDHOOD CENTER,HEARTSHARE HUMAN SERVICES OF NEW YORK,118-03 101 AVENUE,QUEENS,11419,718-805-7117,6413,2015-06-04,Permitted,2 YEARS - 5 YEARS,22,No,Private,0,0,0,0,8
DC2693,DOLLY/FRANK RUSSO/FIRST STEP,HEARTSHARE HUMAN SERVICE OF NEW YORK,118-01 101 AVENUE,QUEENS,11419,718-805-7117,6354,2015-06-13,Permitted,2 YEARS - 5 YEARS,40,No,Private,0,0,0,0,8
DC11636,"DOMINICAN SISTERS FAMILY HEALTH  SERVICES, INC.","DOMINICAN SISTERS FAMILY HEALTH SERVICES, INC.",454 EAST 148 STREET,BRONX,10455,718-993-8963,7138,2015-07-26,Permitted,2 YEARS - 5 YEARS,15,No,Private,6,0,1,5,6
DC2088,"DOMINICAN SISTERS FAMILY HEALTH SERVICES, INC.",DOMINICAN SISTERS FAMILY HEALTH SERVICES INC.,454 EAST 148 STREET,BRONX,10455,718-993-8963,7074,2015-03-02,Permitted,0 YEARS - 2 YEARS,10,No,Private,10,1,3,6,6
DC3123,DOROTHY DAY HEAD START,"BROADWAY HOUSING COMMUNITIES,INC.",583 RIVERSIDE DRIVE,MANHATTAN,10031,212-862-7155,7319,2014-08-25,Permitted,2 YEARS - 5 YEARS,51,No,Head Start (Direct Fed. Funding),5,0,0,5,8
DC14240,DOWNING STREET PLAYGROUP,"THE DOWNING STREET PLAYGROUP, INC.",32 CARMINE STREET,MANHATTAN,10014,212-924-2557,6705,2014-06-08,Expired-InRenewal,2 YEARS - 5 YEARS,15,No,Private,5,1,3,1,4
DC1124,DOWNTOWN  LITTLE  SCHOOL,DOWNTOWN LITTLE SCHOOL,15 DUTCH STREET,MANHATTAN,10038,212-791-1300,7167,2015-09-12,Permitted,2 YEARS - 5 YEARS,75,No,Private,12,2,5,5,5
DC14796,DR C.R. JOHNSON CHRISTIAN DAY CARE,"BROOKLYN TABERNACLE DELIVERANCE CENTER, INC.",600 LAFAYETTE AVENUE,BROOKLYN,11216,718-732-1531,5021,2014-01-18,Expired-InRenewal,2 YEARS - 5 YEARS,29,No,Private,11,1,0,10,7
DC14237,DR. KATHARINE DODGE BROWNELL SCHOOL,"LEAKE AND WATTS SERVICES, INC.",450 CASTLE HILL AVENUE,BRONX,10473,718-430-7938,5963,2015-09-19,Permitted,2 YEARS - 5 YEARS,113,No,Private,11,2,2,7,6
DC21458,DREAMLAND DAY CARE CENTER,DREAMLAND DAY CARE CENTER INC.,1379 WEST 7TH STREET,BROOKLYN,11204,718-232-8155,8228,2014-12-23,Permitted,2 YEARS - 5 YEARS,40,No,Private,41,6,19,16,10
DC14814,DUFFIELD CHILDREN'S CENTER,BROOKLYN BUREAU OF COMMUNITY SERVICE,101 FLEET PLACE,BROOKLYN,11201,718-522-5296,5895,2014-06-14,Permitted,2 YEARS - 5 YEARS,77,No,ACS Contracted Preschools,31,8,8,15,11
DC1938,DUFFIELD CHILDREN'S CENTER HEAD START PROGRAM,BROOKLYN BUREAU OF COMMUNITY SERVICE,101 FLEET PLACE,BROOKLYN,11201,718-522-5296,6518,2014-06-29,Permitted,2 YEARS - 5 YEARS,36,No,Head Start (Direct Fed. Funding),16,5,5,6,8
DC23168,DVORA/PRESCHOOL,"DVORA,INC.",2817 WEST 12TH STREET,BROOKLYN,11224,718-265-4596,35757,2015-03-20,Permitted,2 YEARS - 5 YEARS,35,No,Private,4,3,1,0,2
DC14959,DWIGHT EARLY CHILDHOOD DIVISION,WOODSIDE PRESCHOOL RIVERSIDE BLVD. LLC,140  RIVERSIDE BLVD,MANHATTAN,10069,212-362-2350,7540,2015-12-09,Permitted,2 YEARS - 5 YEARS,75,No,Private,18,2,11,5,5
DC2256,EARLY CHILDHOOD LEARNING CENTER PROGRAMS,LA GUARDIA COMMUNITY COLLEGE -ECLC PROGRAMS INC,31-10 THOMSON AVENUE,QUEENS,11101,718-482-5295,7063,2014-11-17,Permitted,0 YEARS - 2 YEARS,30,No,Private,3,1,1,1,10
DC24612,EARLY LIFE,LUTHERAN SOCIAL SERVICES OF METROPOLITAN NEW YORK,110 WEST 146TH STREET,MANHATTAN,10039,646-478-7949,24818,2014-10-12,Permitted,2 YEARS - 5 YEARS,110,Yes,ACS Contracted Preschools,8,1,7,0,4
DC24609,EARLY LIFE,LUTHERAN SOCIAL SERVICES OF METROPOLITAN NEW YORK,1175 GATES AVENUE,BROOKLYN,11221,212-870-1100,24538,2014-10-10,Permitted,2 YEARS - 5 YEARS,136,No,ACS Contracted Preschools,12,0,5,7,6
DC24614,EARLY LIFE,"LUTHERAN SOCIAL SERVICES OF METROPOLITAN NEW YORK, INC.",151-157 WEST 136TH STREET,MANHATTAN,10030,212-933-1815,24797,2014-10-12,Permitted,2 YEARS - 5 YEARS,66,No,ACS Contracted Preschools,4,0,3,1,3
DC24607,EARLY LIFE,LUTHERAN SOCIAL SERVICES OF METROPOLITAN NEW YORK,200 WEST TREMONT AVENUE,BRONX,10453,917-962-4344,26157,2014-10-24,Permitted,2 YEARS - 5 YEARS,175,Yes,ACS Contracted Preschools,11,1,3,7,3
DC22393,EARLY LIFE,"LUTHERAN SOCIAL SERVICES OF METROPOLITAN NEW YORK, INC.",2125 WATSON AVENUE,BRONX,10472,718-943-0580,28757,2014-12-06,Permitted,2 YEARS - 5 YEARS,115,No,ACS Contracted Preschools,4,1,1,2,4
DC24615,EARLY LIFE,LUTHERAN SOCIAL SERVICES OF METROPOLITAN NEW YORK,218 WEST 147TH STREET,MANHATTAN,10039,646-360-4093,26578,2014-10-26,Permitted,2 YEARS - 5 YEARS,264,No,ACS Contracted Preschools,17,2,11,4,3
DC24610,EARLY LIFE,"LUTHERAN SOCIAL SERVICES OF METROPOLITAN NEW YORK, INC.",265 MARCUS GARVEY BLVD.,BROOKLYN,11221,347-689-8303,24777,2014-10-12,Permitted,2 YEARS - 5 YEARS,116,No,ACS Contracted Preschools,9,1,4,4,5
DC24613,EARLY LIFE,"LUTHERAN SOCIAL SERVICES OF METROPOLITAN NEW YORK, INC.",510-516 WEST 145TH STREET,MANHATTAN,10031,646-449-0814,26441,2014-10-25,Permitted,2 YEARS - 5 YEARS,149,No,ACS Contracted Preschools,9,0,5,4,3
DC24606,EARLY LIFE,"LUTHERAN SOCIAL SERVICES OF METROPOLITAN NEW YORK, INC.",80 EAST 181ST STREET,BRONX,10453,718-365-6247,26737,2014-10-31,Permitted,2 YEARS - 5 YEARS,240,Yes,ACS Contracted Preschools,13,0,6,7,3
DC24608,EARLY LIFE,LUTHERAN SOCIAL SERVICES OF METROPOLITAN NEW YORK,888 WESTCHESTER AVENUE,BRONX,10459,718-450-3556,26118,2014-10-24,Permitted,2 YEARS - 5 YEARS,145,Yes,ACS Contracted Preschools,13,3,3,7,4
DC2975,EARLY SUNRISE PRESCHOOL AND KINDERGARTEN,"EARLY SUNRISE PRE-SCHOOL AND KINDERGARTEN,INC.",187-08 HILLSIDE AVENUE,QUEENS,11432,718-736-9064,6827,2014-10-25,Permitted,2 YEARS - 5 YEARS,29,No,Private,6,1,4,1,11
DC1178,"EARLY SUNRISE PRESCHOOL&KINDERGARTEN,INC.","EARLY SUNRISE PRESCHOOL&KINDERGARTEN,INC.",187-10 HILLSIDE AVENUE,QUEENS,11432,718-736-9064,7000,2014-07-07,Permitted,2 YEARS - 5 YEARS,29,No,Private,7,0,7,0,8
DC18943,EAST BRONX DAY CARE,TREMONT CROTONA DAY CARE CENTER INC.,1113 COLGATE AVENUE,BRONX,10472,718-617-2900,7942,2014-09-12,Permitted,2 YEARS - 5 YEARS,80,No,ACS Contracted Preschools,39,8,10,21,14
DC1493,EAST CALVARY DAY CARE CENTER INC.,EAST CALVARY DAY CARE CENTER INC.,1 WEST 112 STREET,MANHATTAN,10026,212-534-5249,1483,2015-03-27,Permitted,2 YEARS - 5 YEARS,59,No,ACS Contracted Preschools,15,0,5,10,8
DC2419,EAST CHELSEA CHILDRENS WORKSHOP,JACQUELYN MARKS,17 EAST 16 STREET,MANHATTAN,10003,212-691-8964,4869,2015-07-15,Permitted,2 YEARS - 5 YEARS,29,No,Private,15,2,5,8,5
DC1242,EAST HARLEM BILINGUAL   HEAD START,"EAST HARLEM COUNCIL FOR HUMAN SERVICES,INC.",440 EAST 116 STREET,MANHATTAN,10029,212-427-9010,4529,2014-10-26,Permitted,2 YEARS - 5 YEARS,160,No,ACS Head Start,6,0,5,1,8
DC1285,EAST HARLEM BLOCK  NURSERY #2,EAST HARLEM BLOCK SCHOOLS,2112 MADISON AVENUE,MANHATTAN,10037,212-234-3333,879,2014-05-04,Expired-InRenewal,2 YEARS - 5 YEARS,79,No,ACS Contracted Preschools,47,6,20,21,9
DC2153,EAST HARLEM BLOCK NURSERY #1,"EAST HARLEM BLOCK NURSERY,INC.",215 EAST 106 STREET,MANHATTAN,10029,212-427-2571,2261,2015-07-02,Permitted,2 YEARS - 5 YEARS,56,No,ACS Contracted Preschools,15,2,10,3,7
DC21651,EAST HARLEM BLOCK NURSERY/GRANT DAY CARE CENTER,"EAST HARLEM BLOCK NURSERY, INC.",1299 AMSTERDAM AVENUE,MANHATTAN,10027,212-666-6000,8281,2015-05-23,Permitted,2 YEARS - 5 YEARS,68,No,ACS Contracted Preschools,20,4,11,5,9
DC11067,EAST HARLEM COUNCIL FOR HUMAN SERVICES INC.BILINGUAL HEAD START,EAST HARLEM COUNCIL FOR HUMAN SERVICES INC.,30 EAST 111 STREET,MANHATTAN,10029,212-860-7201,6385,2015-01-24,Permitted,2 YEARS - 5 YEARS,87,No,ACS Head Start,11,3,6,2,8
DC1785,EAST MIDWOOD HEBREW DAY SCHOOL,RABBI HARRY HALPERN DAY SCHOOL,1256 EAST 21 STREET,BROOKLYN,11210,718-253-1555,1465,2014-10-28,Permitted,2 YEARS - 5 YEARS,83,No,Private,11,0,5,6,5
DC2635,EAST RIVER CHILD DEVELOPMENT CENTER,EAST RIVER CHILD DEVELOPMENT CENTER,570 GRAND STREET,MANHATTAN,10002,212-254-7301,6952,2016-02-29,Permitted,2 YEARS - 5 YEARS,37,No,Private,6,0,3,3,4
DC1446,EAST RIVER CHILD DEVELOPMENT CENTER,EAST RIVER CHILD DEVELOPMENT CENTER,577 GRAND STREET,MANHATTAN,10002,212-254-7300,4149,2015-07-18,Permitted,2 YEARS - 5 YEARS,77,No,Private,7,0,3,4,6
DC181,EAST SIDE HOUSE SETTLEMENT HEAD START/DAY CARE,EAST SIDE HOUSE SETTLEMENT,201 ST. ANN'S AVENUE,BRONX,10454,718-993-4854,4636,2014-07-17,Permitted,2 YEARS - 5 YEARS,27,No,ACS Head Start,4,2,1,1,7
DC182,EAST SIDE HOUSE SETTLEMENT HEAD START/DAY CARE,EAST SIDE HOUSE SETTLEMENT,375 EAST 143RD STREET,BRONX,10454,718-292-5335,2094,2014-11-10,Permitted,2 YEARS - 5 YEARS,80,No,ACS Head Start,12,2,6,4,5
DC14111,EAST SIDE SETTLEMENT HOUSE HEAD START/ DAY CARE,EAST SIDE HOUSE SETTLEMENT,414 MORRIS AVENUE,BRONX,10451,718-401-4242,7400,2015-06-28,Permitted,2 YEARS - 5 YEARS,60,No,ACS Contracted Preschools,3,0,2,1,6
DC1643,EAST TREMONT CHILD CARE AND DEVELOPMENT CENTER,EAST TREMONT CHILD CARE AND DEVELOPMENT CENTER,1811 CROTONA AVENUE,BRONX,10457,718-731-4166,1956,2014-08-17,Permitted,2 YEARS - 5 YEARS,60,Yes,ACS Contracted Preschools,16,4,6,6,10
DC979,"EAST TREMONT HEAD START ALUMNI DCC, INC./ PAUL T. MATSON HEAD START SITE I I I",EAST TREMONT HEAD START ALUMNI DCC,2431 MORRIS AVENUE,BRONX,10468,718-563-5139,6209,2015-09-10,Permitted,2 YEARS - 5 YEARS,55,Yes,ACS Contracted Preschools,9,1,5,3,7
DC1484,EAST VILLAGE CHILD CARE CENTER,EAST VILLAGE CHILD CARE CENTER,297 EAST 10 STREET,MANHATTAN,10009,212-982-8701,5039,2016-02-06,Permitted,2 YEARS - 5 YEARS,15,No,Private,4,2,1,1,4
DC17787,EASTER SEALS CHILD DEVELOPMENT CENTER,"EASTER SEALS NEW YORK, INC.",2433 EAST TREMONT AVENUE,BRONX,10461,718-409-4227,7815,2015-10-15,Permitted,2 YEARS - 5 YEARS,121,No,ACS Contracted Preschools,16,2,5,9,6
DC15104,ECDO  CHILDSTART CENTER,ECUMENICAL COMMUNITY DEVELOPMENT ORGANIZATION,249 WEST 144TH STREET,MANHATTAN,10030,212-234-8135,7439,2015-09-23,Permitted,2 YEARS - 5 YEARS,69,No,ACS Head Start,12,1,7,4,8
DC1832,EDEN CHRISTIAN ACADEMY & EARLY CHILDHOOD CENTER,EDEN CHRISTIAN ACADEMY & EARLY CHILDHOOD CENTER,1509 MORRIS AVENUE,BRONX,10457,718-684-2962,7142,2016-03-08,Permitted,2 YEARS - 5 YEARS,27,No,Private,123,19,55,49,15
DC2095,EDUCATIONAL ALLIANCE  HEAD START,THE EDUCATIONAL ALLIANCE,333 EAST 4 STREET,MANHATTAN,10009,212-254-2614,7272,2015-02-26,Permitted,2 YEARS - 5 YEARS,40,No,Head Start (Direct Fed. Funding),8,0,6,2,4
DC1642,EDWARDS L. CLEAVELAND DAY CARE CENTER,BROOKLYN KINDERGARTEN SOCIETY,1185 PARK PLACE,BROOKLYN,11213,718-778-6559,1848,2015-02-27,Permitted,2 YEARS - 5 YEARS,74,No,ACS Contracted Preschools,38,2,24,12,15
DC18141,EFFIE B'S EARLY CHILDHOOD DEVELOPMENT CENTER,EFFIE B'S EARLY CHILDHOOD DEVELOPMENT CENTER CORP.,1173 EASTERN PARKWAY,BROOKLYN,11213,718-735-5500,8096,2015-11-16,Permitted,0 YEARS - 2 YEARS,28,No,Private,40,7,22,11,12
DC20208,"EFFIE B'S EARLY CHILDHOOD DEVELOPMENT CENTER, PRESCHOOL",EFFIE B'S EARLY CHILDHOOD DEVELOPMENT CENTER CORP.,1173 EASTERN PARKWAY,BROOKLYN,11213,718-735-5500,8095,2015-11-16,Permitted,2 YEARS - 5 YEARS,35,No,Private,30,5,11,14,13
DC25918,EL SHADDAI INTERNATIONAL,VIOLET APPLEWHITE,1475 HAMMERSLEY AVENUE,BRONX,10469,718-515-5004,52818,2015-10-04,Permitted,2 YEARS - 5 YEARS,95,No,Private,0,0,0,0,0
DC22613,ELADIA'S  KIDS,ELADIA'S KIDS PARENT LLC,266 FLATBUSH AVENUE,BROOKLYN,11217,718-230-7560,21817,2014-08-31,Permitted,2 YEARS - 5 YEARS,42,No,Private,3,2,0,1,9
DC15647,ELADIA'S KIDS,ELADIA'S KIDS PARENT LLC,147 5TH AVENUE,BROOKLYN,11217,718-622-3316,7767,2015-06-11,Permitted,0 YEARS - 2 YEARS,18,No,Private,8,3,3,2,7
DC23039,ELADIA'S KIDS,"ELADIA'S KIDS PARENT, LLC",175 VANDERBILT AVENUE,BROOKLYN,11205,718-230-7560,43797,2015-06-14,Permitted,0 YEARS - 2 YEARS,14,No,Private,6,1,2,3,2
DC23041,ELADIA'S KIDS,ELADIA'S KIDS PARENT LLC,175 VANDERBILT AVENUE,BROOKLYN,11205,718-522-6361,43777,2015-06-14,Permitted,2 YEARS - 5 YEARS,35,No,Private,0,0,0,0,2
DC20505,ELADIA'S KIDS,ELADIA'S KIDS PARENTS LLC,266 FLATBUSH AVENUE,BROOKLYN,11217,718-230-7560,8186,2016-06-10,Permitted,0 YEARS - 2 YEARS,27,No,Private,19,0,10,9,9
